article_id,title,author,year,issue,volume,pdf_url
3694,基于大数据平台的肝细胞癌自动化中国分期模型研究,"王垒, 曾建兴, 陈振伟, 郭鹏飞, 刘景丰",2020,02,09,https://zhgzwkssxdzzz.cma-cmc.com.cn//CN/article/downloadArticleFile.do?attachType=PDF&id=3694
3695,吲哚氰绿荧光显像导航技术在复发性肝癌腹腔镜再次肝切除中的应用,"谢国伟, 李嘉鑫, 吴泓",2020,02,09,https://zhgzwkssxdzzz.cma-cmc.com.cn//CN/article/downloadArticleFile.do?attachType=PDF&id=3695
3696,术前基于三维可视化技术精准设计肝离断面在ALPPS中的应用,"谭凯, 杜锡林, 陈安, 杨涛, 臧莉, 贺小军, 刘周, 封兰兰, 杨振宇",2020,02,09,https://zhgzwkssxdzzz.cma-cmc.com.cn//CN/article/downloadArticleFile.do?attachType=PDF&id=3696
3697,腹腔镜解剖性顺时针四切面肝中叶切除的策略与技巧,"叶青, 何军明, 彭建新, 郑志鹏, 刁竞芳, 莫嘉强",2020,02,09,https://zhgzwkssxdzzz.cma-cmc.com.cn//CN/article/downloadArticleFile.do?attachType=PDF&id=3697
3698,增强现实技术联合ICG分子荧光影像导航3D腹腔镜右半肝切除术（附视频）,"方驰华, 张鹏, 杨剑, 胡浩宇, 曾思略, 祝文, 文赛",2020,02,09,https://zhgzwkssxdzzz.cma-cmc.com.cn//CN/article/downloadArticleFile.do?attachType=PDF&id=3698
3699,合并门静脉血栓患者肝移植术中血栓处理技巧,"于里涵, 汤睿, 李昂, 张新静, 杨世伟, 韩东冬, 董家鸿, 卢倩",2020,02,09,https://zhgzwkssxdzzz.cma-cmc.com.cn//CN/article/downloadArticleFile.do?attachType=PDF&id=3699
3700,腹腔镜胰十二指肠切除术50例临床治疗体会,"何辉虎, 张登勇, 孙万亮, 马翔, 鲁正",2020,02,09,https://zhgzwkssxdzzz.cma-cmc.com.cn//CN/article/downloadArticleFile.do?attachType=PDF&id=3700
3701,Habib 4X在腹腔镜脾部分切除术中的应用价值,"马靖, 王卫东, 刘清波, 林杰, 何威, 陈坚平",2020,02,09,https://zhgzwkssxdzzz.cma-cmc.com.cn//CN/article/downloadArticleFile.do?attachType=PDF&id=3701
3702,miR-181b在胆管癌患者中表达及功能研究,"江哲龙, 杨和君, 潘凡, 吕立志, 江艺",2020,02,09,https://zhgzwkssxdzzz.cma-cmc.com.cn//CN/article/downloadArticleFile.do?attachType=PDF&id=3702
3703,基于生物信息学数据库探讨STX6基因在肝细胞癌中的表达及临床意义,"梁梓明, 叶林森, 唐晖, 宋来恩, 顾世杰, 易述红",2020,02,09,https://zhgzwkssxdzzz.cma-cmc.com.cn//CN/article/downloadArticleFile.do?attachType=PDF&id=3703
3704,PTTG1基因在乙醇诱导的LO2肝细胞急性损伤中的作用,"田轩, 沙菲菲, 王家玉, 郭云蔚",2020,02,09,https://zhgzwkssxdzzz.cma-cmc.com.cn//CN/article/downloadArticleFile.do?attachType=PDF&id=3704
3705,肝癌微创介入治疗,"刘允怡, 赖俊雄",2020,03,09,https://zhgzwkssxdzzz.cma-cmc.com.cn//CN/article/downloadArticleFile.do?attachType=PDF&id=3705
3706,肝切除术后肝衰竭的早期诊断和预防,"王瑶, 钱叶本",2020,03,09,https://zhgzwkssxdzzz.cma-cmc.com.cn//CN/article/downloadArticleFile.do?attachType=PDF&id=3706
3707,结直肠癌肝转移外科治疗,"裴谦, 裴海平",2020,03,09,https://zhgzwkssxdzzz.cma-cmc.com.cn//CN/article/downloadArticleFile.do?attachType=PDF&id=3707
3708,创伤递增式手术模式治疗重症急性胰腺炎,"姚佳柔, 田彦璋, 刘世洲",2020,03,09,https://zhgzwkssxdzzz.cma-cmc.com.cn//CN/article/downloadArticleFile.do?attachType=PDF&id=3708
3709,环状胰腺诊治进展,"汪学艳, 白琪, 冯泽东, 王博方, 俞阳, 周文策, 王思平, 陈昊",2020,03,09,https://zhgzwkssxdzzz.cma-cmc.com.cn//CN/article/downloadArticleFile.do?attachType=PDF&id=3709
3710,两种营养风险筛查方法在加速康复模式下肝癌肝切除围手术期应用比较,"宋鹏, 毛谅, 卞晓洁, 周铁, 凡银银, 张静, 孙士全, 严笑鹏, 伏旭, 仇毓东",2020,03,09,https://zhgzwkssxdzzz.cma-cmc.com.cn//CN/article/downloadArticleFile.do?attachType=PDF&id=3710
3711,加速康复外科模式在肝门部胆管癌围手术期中的应用,"周兵, 孙勇, 刘翠",2020,03,09,https://zhgzwkssxdzzz.cma-cmc.com.cn//CN/article/downloadArticleFile.do?attachType=PDF&id=3711
3712,间充质干细胞治疗肝移植术后难治性急性呼吸窘迫综合征,"郭俊, 易小猛, 安玉玲, 魏绪霞, 范明明, 黎利娟, 陆平兰, 易慧敏, 吕海金",2020,03,09,https://zhgzwkssxdzzz.cma-cmc.com.cn//CN/article/downloadArticleFile.do?attachType=PDF&id=3712
3713,肝囊型包虫病手术患者胆漏发生危险因素分析及预测模型建立,"张永国, 胥瑾, 樊海宁, 祁之俊, 孔广玺, 周虎, 许晓磊, 王展",2020,03,09,https://zhgzwkssxdzzz.cma-cmc.com.cn//CN/article/downloadArticleFile.do?attachType=PDF&id=3713
3714,肝囊型包虫病胆瘘发生影响因素分析,"巴合提·卡力甫, 孟塬, 陈伦牮, 马志刚, 王锦国, 宋巍, 田广磊, 阿卜来海提·麦提色依提, 陈雄",2020,03,09,https://zhgzwkssxdzzz.cma-cmc.com.cn//CN/article/downloadArticleFile.do?attachType=PDF&id=3714
3715,三维可视化技术在严重肝外伤救治中的应用,"沈佳佳, 张小进, 潘凡, 江艺, 吴爱平",2020,03,09,https://zhgzwkssxdzzz.cma-cmc.com.cn//CN/article/downloadArticleFile.do?attachType=PDF&id=3715
3716,肝癌患者循环肿瘤细胞PD-L1表达及其临床意义,"林俊龙, 黄贻培, 罗伟鑫, 许磊波, 刘超",2020,03,09,https://zhgzwkssxdzzz.cma-cmc.com.cn//CN/article/downloadArticleFile.do?attachType=PDF&id=3716
3717,肝细胞癌破裂出血的治疗,"李清汉, 甄作均, 陈应军, 司徒翠瑶",2020,03,09,https://zhgzwkssxdzzz.cma-cmc.com.cn//CN/article/downloadArticleFile.do?attachType=PDF&id=3717
3718,动态监测肝癌手术患者血清sIL-2R的意义及其来源探讨,"陆旭, 周闯, 叶健文, 董琳, 赵璐, 翟文龙",2020,03,09,https://zhgzwkssxdzzz.cma-cmc.com.cn//CN/article/downloadArticleFile.do?attachType=PDF&id=3718
3719,三种不同入路超声引导腹横肌平面阻滞在肝癌切除术中镇痛效果比较,"陈佳婷, 谭雷, 杨小立, 黄群, 伍堂洪, 陈杰桓",2020,03,09,https://zhgzwkssxdzzz.cma-cmc.com.cn//CN/article/downloadArticleFile.do?attachType=PDF&id=3719
3720,HBV感染对体外培养NK细胞生物活性影响的研究,"蔡惠宁, 许燕, 陈晓燕, 陈伟材, 郑小芳",2020,03,09,https://zhgzwkssxdzzz.cma-cmc.com.cn//CN/article/downloadArticleFile.do?attachType=PDF&id=3720
3721,ASTN1表达与肝细胞癌侵袭转移及预后的关系,"陈奇峰, 黄涛, 沈露俊, 李旺, 吴沛宏",2020,03,09,https://zhgzwkssxdzzz.cma-cmc.com.cn//CN/article/downloadArticleFile.do?attachType=PDF&id=3721
3722,脂多糖诱导小鼠肝癌YAP表达及其调控巨噬细胞极化的研究,"郑啟发, 李华, 袁泽南, 叶林森, 朱曙光, 夏龙",2020,03,09,https://zhgzwkssxdzzz.cma-cmc.com.cn//CN/article/downloadArticleFile.do?attachType=PDF&id=3722
3723,LINC00467调控CDK1和CDC45促进肝细胞癌对索拉非尼耐药的研究,"林治荣, 谭文亮, 覃胜海, 陈新明, 陈亚进, 商昌珍",2020,03,09,https://zhgzwkssxdzzz.cma-cmc.com.cn//CN/article/downloadArticleFile.do?attachType=PDF&id=3723
3724,游离核酸在器官移植中的应用及临床意义,"李梦婷, 陈楠, 李世成, 祝小荐, 古肖湘, 刘政, 万绍贵",2020,03,09,https://zhgzwkssxdzzz.cma-cmc.com.cn//CN/article/downloadArticleFile.do?attachType=PDF&id=3724
3725,胆管囊肿分型及诊治策略,"胡继科, 马延龄, 王丹, 刘小龙, 赵成基, 李崇辉, 陈昊",2020,04,09,https://zhgzwkssxdzzz.cma-cmc.com.cn//CN/article/downloadArticleFile.do?attachType=PDF&id=3725
3726,多囊肝的外科及药物治疗,"谢峰, 宫琳, 王鹏",2020,04,09,https://zhgzwkssxdzzz.cma-cmc.com.cn//CN/article/downloadArticleFile.do?attachType=PDF&id=3726
3727,结直肠癌肝转移的外科治疗进展,"刘聪, 毛家玺, 滕飞",2020,04,09,https://zhgzwkssxdzzz.cma-cmc.com.cn//CN/article/downloadArticleFile.do?attachType=PDF&id=3727
3728,胆总管结石微创外科治疗,"刘世洲, 田彦璋",2020,04,09,https://zhgzwkssxdzzz.cma-cmc.com.cn//CN/article/downloadArticleFile.do?attachType=PDF&id=3728
3729,解剖性肝段切除术关键技术和争议,"王晓耘, 马增辉, 史佩东",2020,04,09,https://zhgzwkssxdzzz.cma-cmc.com.cn//CN/article/downloadArticleFile.do?attachType=PDF&id=3729
3730,肝癌影像-数字化大体病理标本制作流程规范,"禹鸿鸣, 王康, 董辉, 蔡权宇, 贾宁阳, 丛文铭, 程树群",2020,04,09,https://zhgzwkssxdzzz.cma-cmc.com.cn//CN/article/downloadArticleFile.do?attachType=PDF&id=3730
3731,不同部位结肠癌肝转移临床病理特点及其术后预后影响因素分析,"施长鹰, 董志涛, 廖博懿, 乔亮, 沈伟峰, 杨甲梅",2020,04,09,https://zhgzwkssxdzzz.cma-cmc.com.cn//CN/article/downloadArticleFile.do?attachType=PDF&id=3731
3732,乳腺癌肝转移肝切除术后患者预后影响因素分析,"徐伟熙, 陈钦昌, 翁子晋, 邱万寿, 黄泽楠",2020,04,09,https://zhgzwkssxdzzz.cma-cmc.com.cn//CN/article/downloadArticleFile.do?attachType=PDF&id=3732
3733,腹腔镜下超声引导微波消融治疗巨大肝血管瘤疗效分析,"陈亚峰, 杜锡林, 董瑞, 鲁建国, 臧莉",2020,04,09,https://zhgzwkssxdzzz.cma-cmc.com.cn//CN/article/downloadArticleFile.do?attachType=PDF&id=3733
3734,应用空白微球行TACE治疗肝癌临床疗效分析,"张发林, 雍昉",2020,04,09,https://zhgzwkssxdzzz.cma-cmc.com.cn//CN/article/downloadArticleFile.do?attachType=PDF&id=3734
3735,术前口服碳水化合物对ERCP术后患者胰岛素抵抗及心理康复的影响,"龚宇蓉, 蔡丹, 翁明哲",2020,04,09,https://zhgzwkssxdzzz.cma-cmc.com.cn//CN/article/downloadArticleFile.do?attachType=PDF&id=3735
3736,经胰管括约肌切开联合胰管支架植入在ERCP困难插管中的应用,"李甫, 张晞文, 唐睿, 黄金鑫, 吉建梅, 龚彪, 丁俊",2020,04,09,https://zhgzwkssxdzzz.cma-cmc.com.cn//CN/article/downloadArticleFile.do?attachType=PDF&id=3736
3737,日间胆道镜手术治疗胆道术后残余结石临床疗效,"吉琳, 吝怡, 李益行, 樊茜, 陈雯雯, 赵泓玮, 徐庶钦, 雷凤萍, 王方舟, 李露新, 常凯曦, 张至轩, 周古翔, 吕毅, 严小鹏",2020,04,09,https://zhgzwkssxdzzz.cma-cmc.com.cn//CN/article/downloadArticleFile.do?attachType=PDF&id=3737
3738,肝门板分离技术在腹腔镜解剖性肝右叶切除中的应用价值,"符荣党, 陈焕伟, 李杰原, 邓斐文, 王峰杰, 麦结珍, 张晓红",2020,04,09,https://zhgzwkssxdzzz.cma-cmc.com.cn//CN/article/downloadArticleFile.do?attachType=PDF&id=3738
3739,ERCP在原位肝移植术后早期胆道并发症中的应用,"郭亚飞, 黄德好, 吴维, 黄强, 刘连新",2020,04,09,https://zhgzwkssxdzzz.cma-cmc.com.cn//CN/article/downloadArticleFile.do?attachType=PDF&id=3739
3740,同轴套管针穿刺活检联合超声造影在肝脏占位性病变中的应用价值,"谭雷, 傅斌生, 黄倩楠, 赵畅, 李凯, 郑荣琴, 吴泽倩",2020,04,09,https://zhgzwkssxdzzz.cma-cmc.com.cn//CN/article/downloadArticleFile.do?attachType=PDF&id=3740
3741,心脏死亡器官捐献供者评估和器官功能维护,"陈晓桦, 赖汝标, 钟飞雁, 易述红, 杨扬, 陈规划",2020,04,09,https://zhgzwkssxdzzz.cma-cmc.com.cn//CN/article/downloadArticleFile.do?attachType=PDF&id=3741
3742,过表达Nrf2人脐带间充质干细胞对小鼠肝脏缺血-再灌注损伤的保护作用,"刘荣强, 林国桢, 代天星, 邓铭彬, 周朝荣, 汪国营",2020,04,09,https://zhgzwkssxdzzz.cma-cmc.com.cn//CN/article/downloadArticleFile.do?attachType=PDF&id=3742
3743,miR-181b与胃癌肝转移生存预后相关性研究,"严庆波, 李佩, 林惠明",2020,04,09,https://zhgzwkssxdzzz.cma-cmc.com.cn//CN/article/downloadArticleFile.do?attachType=PDF&id=3743
3744,miR-122与结直肠癌术后肝转移的关系,"李佩, 鲁祖斌, 严庆波, 刘妍, 黄坤镒, 张鸣青, 董俊",2020,04,09,https://zhgzwkssxdzzz.cma-cmc.com.cn//CN/article/downloadArticleFile.do?attachType=PDF&id=3744
3745,木香烃内酯对胆囊癌的抗肿瘤活性及其机制,"张晓宇, 翟天宇, 黑振宇, 周迪, 王健东",2020,04,09,https://zhgzwkssxdzzz.cma-cmc.com.cn//CN/article/downloadArticleFile.do?attachType=PDF&id=3745
3746,"全腹腔镜""顺时针四切面法""解剖性肝中叶切除治疗肝癌一例","王剑一, 杨达钧, 何军明",2020,04,09,https://zhgzwkssxdzzz.cma-cmc.com.cn//CN/article/downloadArticleFile.do?attachType=PDF&id=3746
3747,肝移植术后新发胰腺体尾部癌一例,"周尊强, 关蛟, 张正筠, 赵冲跃, 陈世赓, 孙建华, 周光文",2020,04,09,https://zhgzwkssxdzzz.cma-cmc.com.cn//CN/article/downloadArticleFile.do?attachType=PDF&id=3747
216,胰腺导管内乳头状瘤术前评估与术中规划,"李伦旭, 尚东",2020,05,09,https://zhgzwkssxdzzz.cma-cmc.com.cn//CN/article/downloadArticleFile.do?attachType=PDF&id=216
217,胰腺神经内分泌瘤肝转移手术治疗进展,"陈晴, 阿卜杜海拜尔•萨杜拉, 姜浩然, 原春辉",2020,05,09,https://zhgzwkssxdzzz.cma-cmc.com.cn//CN/article/downloadArticleFile.do?attachType=PDF&id=217
218,"感染性坏死性胰腺炎微创""阶梯式""治疗策略","李峰, 王磊",2020,05,09,https://zhgzwkssxdzzz.cma-cmc.com.cn//CN/article/downloadArticleFile.do?attachType=PDF&id=218
219,慢性胰腺炎外科治疗,"庄岩, 田孝东, 高红桥, 杨尹默",2020,05,09,https://zhgzwkssxdzzz.cma-cmc.com.cn//CN/article/downloadArticleFile.do?attachType=PDF&id=219
220,胰腺癌新辅助化疗疗效评估及手术时机,"郑明辉, 邵成浩",2020,05,09,https://zhgzwkssxdzzz.cma-cmc.com.cn//CN/article/downloadArticleFile.do?attachType=PDF&id=220
221,IgG4相关自身免疫性胰腺炎诊治,"张荣华, 刘乔飞, 廖泉",2020,05,09,https://zhgzwkssxdzzz.cma-cmc.com.cn//CN/article/downloadArticleFile.do?attachType=PDF&id=221
222,液体活检在胰腺癌诊治中的应用价值,"杨正江, 辛万鹏, 肖卫东",2020,05,09,https://zhgzwkssxdzzz.cma-cmc.com.cn//CN/article/downloadArticleFile.do?attachType=PDF&id=222
223,劈离式肝移植专家共识,"中华医学会外科学分会外科手术学学组, 中华医学会外科学分会移植学组",2020,05,09,https://zhgzwkssxdzzz.cma-cmc.com.cn//CN/article/downloadArticleFile.do?attachType=PDF&id=223
224,淋巴结转移在无功能型胰腺神经内分泌肿瘤外科治疗中的意义,"许文彦, 吉顺荣, 刘文生, 秦毅, 徐晓武, 虞先濬",2020,05,09,https://zhgzwkssxdzzz.cma-cmc.com.cn//CN/article/downloadArticleFile.do?attachType=PDF&id=224
225,预后营养指数在胰头和壶腹周围癌腹腔镜胰十二指肠切除术后患者预后中的价值,"蔡健华, 何嘉琦, 刘猛, 王巍",2020,05,09,https://zhgzwkssxdzzz.cma-cmc.com.cn//CN/article/downloadArticleFile.do?attachType=PDF&id=225
226,高甘油三酯血症急性胰腺炎与胆源性急性胰腺炎临床特征比较,"严舒, 李勇, 范婧妍, 吴妮莎, 周国俊, 李建水, 冷政伟",2020,05,09,https://zhgzwkssxdzzz.cma-cmc.com.cn//CN/article/downloadArticleFile.do?attachType=PDF&id=226
227,奥曲肽预防胰十二指肠切除术后胰瘘疗效分析,"王楚斯, 张磊, 钟跃思, 潘卫东",2020,05,09,https://zhgzwkssxdzzz.cma-cmc.com.cn//CN/article/downloadArticleFile.do?attachType=PDF&id=227
228,手工缝合与闭合器闭合预防胰体尾切除术后胰瘘疗效Meta分析,"孟珊珊, 刘蕊, 吴昊, 魏锋, 王小磊",2020,05,09,https://zhgzwkssxdzzz.cma-cmc.com.cn//CN/article/downloadArticleFile.do?attachType=PDF&id=228
229,同种异体胰岛细胞移植在成人1型糖尿病中的应用,"陈焕伟, 栾晓军, 刘成洋, 肖平, 陈劲松, 王晓洲, 邓斐文, 刘颖, 陈国强",2020,05,09,https://zhgzwkssxdzzz.cma-cmc.com.cn//CN/article/downloadArticleFile.do?attachType=PDF&id=229
230,腹腔镜胰十二指肠切除术13例临床分析,"梁嘉毅, 张旭峰, 何晓, 谢斌辉, 刘清泉",2020,05,09,https://zhgzwkssxdzzz.cma-cmc.com.cn//CN/article/downloadArticleFile.do?attachType=PDF&id=230
231,ERCP治疗胰管结石,"尹振宇, 刘乾, 李晓梅, 齐文博, 刘乐, 白玉萍, 陈昊",2020,05,09,https://zhgzwkssxdzzz.cma-cmc.com.cn//CN/article/downloadArticleFile.do?attachType=PDF&id=231
232,公民逝世后合并全身感染供者实体器官捐献——单中心经验,"钟飞雁, 邬伟健, 谢海君, 易慧敏, 易述红, 杨扬",2020,05,09,https://zhgzwkssxdzzz.cma-cmc.com.cn//CN/article/downloadArticleFile.do?attachType=PDF&id=232
233,腹腔镜胆囊切除胆道探查一期缝合治疗胆囊结石合并胆总管结石,"田朕安, 张恒, 段小辉, 田秉璋, 杨建辉, 张鸿渐, 毛先海",2020,05,09,https://zhgzwkssxdzzz.cma-cmc.com.cn//CN/article/downloadArticleFile.do?attachType=PDF&id=233
234,超声引导下第二肝门旁肝细胞癌热消融疗效,"凌云彪, 张小丹, 吴宇轩, 罗丽萍, 曾庆劲, 李凯, 郑荣琴, 许尔蛟",2020,05,09,https://zhgzwkssxdzzz.cma-cmc.com.cn//CN/article/downloadArticleFile.do?attachType=PDF&id=234
235,磁锚定技术辅助减Trocar腹腔镜胆囊切除术的实验研究,"白纪刚, 吝怡, 刘博, 张力维, 李益行, 樊茜, 吉琳, 于璧欣, 禄彦锋, 朱帕尔·阿达力, 孙健钟, 张勇, 吕毅, 严小鹏",2020,05,09,https://zhgzwkssxdzzz.cma-cmc.com.cn//CN/article/downloadArticleFile.do?attachType=PDF&id=235
236,基于生物信息学研究肝癌发生相关基因及其功能,"周国俊, 应伟, 李文菠, 冯彦超, 吴妮莎, 黄理政, 雷蕾, 侍琳, 冷政伟",2020,05,09,https://zhgzwkssxdzzz.cma-cmc.com.cn//CN/article/downloadArticleFile.do?attachType=PDF&id=236
237,腹腔镜技术在保留十二指肠胰头切除术中的应用（附视频）,"李伟男, 杨刚, 孙骥, 熊永福, 李敬东",2020,05,09,https://zhgzwkssxdzzz.cma-cmc.com.cn//CN/article/downloadArticleFile.do?attachType=PDF&id=237
238,全腹腔镜保留十二指肠胰头切除术治疗胰头假性囊肿一例（附视频）,"许侨东, 古松钢, 梁家宏, 林志华, 郑少东, 张培东, 黄文龙, 严江",2020,05,09,https://zhgzwkssxdzzz.cma-cmc.com.cn//CN/article/downloadArticleFile.do?attachType=PDF&id=238
18155,肝内胆管癌异常脂质代谢研究进展,"童焕军, 汤朝晖, 全志伟",2020,06,09,https://zhgzwkssxdzzz.cma-cmc.com.cn//CN/article/downloadArticleFile.do?attachType=PDF&id=18155
18156,巴德-吉亚利综合征并发上消化道出血治疗策略,"党晓卫, 沈东启, 李路豪",2020,06,09,https://zhgzwkssxdzzz.cma-cmc.com.cn//CN/article/downloadArticleFile.do?attachType=PDF&id=18156
18157,CNLC-Ⅰb期巨大肝癌外科治疗策略,"陈子祥, 刘付宝, 陈江明, 方强, 濮天",2020,06,09,https://zhgzwkssxdzzz.cma-cmc.com.cn//CN/article/downloadArticleFile.do?attachType=PDF&id=18157
18158,合并肥胖肝移植患者减重手术策略,"李乐, 曲伟, 张宇红, 肖飞, 朱志军",2020,06,09,https://zhgzwkssxdzzz.cma-cmc.com.cn//CN/article/downloadArticleFile.do?attachType=PDF&id=18158
18159,ERCP在恶性胆道梗阻中的应用进展,"刘忠涛, 刘威, 何超",2020,06,09,https://zhgzwkssxdzzz.cma-cmc.com.cn//CN/article/downloadArticleFile.do?attachType=PDF&id=18159
18160,肝胆胰恶性肿瘤腹腔化疗专家共识（2020版）,肝胆胰恶性肿瘤腹腔化疗专家组,2020,06,09,https://zhgzwkssxdzzz.cma-cmc.com.cn//CN/article/downloadArticleFile.do?attachType=PDF&id=18160
18161,APRI在肝细胞癌淋巴结转移术后患者预后中的价值,"阿力木江·买合木提, 冷超, 徐磊, 陈孝平, 陈义发",2020,06,09,https://zhgzwkssxdzzz.cma-cmc.com.cn//CN/article/downloadArticleFile.do?attachType=PDF&id=18161
18162,肝切除联合淋巴结清扫对临床淋巴结阴性肝内胆管癌患者预后的价值,"黄徐建, 杨发才, 李梦, 刘小鹏, 陈泰安, 何毅, 李强, 徐建, 杨刚, 邬长康, 熊永福, 李敬东",2020,06,09,https://zhgzwkssxdzzz.cma-cmc.com.cn//CN/article/downloadArticleFile.do?attachType=PDF&id=18162
18163,腹腔镜肝癌切除术中CVP与出血量关系及其影响因素,"李文轩, 潘扬勋, 侯嘉杰, 侯靖禹, 陆霄云, 赖仁纯, 王小辉, 王骏成, 徐立, 张耀军, 陈敏山, 周仲国",2020,06,09,https://zhgzwkssxdzzz.cma-cmc.com.cn//CN/article/downloadArticleFile.do?attachType=PDF&id=18163
18164,肝硬度值及标准残肝体积在肝癌半肝切除术后肝功能不全中的预测价值,"吴金柱, 王建新, 蔡卫华, 陈琳, 肖锋, 朱任飞",2020,06,09,https://zhgzwkssxdzzz.cma-cmc.com.cn//CN/article/downloadArticleFile.do?attachType=PDF&id=18164
18165,腹腔镜与开腹肝切除术安全性及近期疗效比较,"刘一博, 孟兴凯, 任建军, 李军, 乔建梁, 张俊晶",2020,06,09,https://zhgzwkssxdzzz.cma-cmc.com.cn//CN/article/downloadArticleFile.do?attachType=PDF&id=18165
18166,腹腔镜前入路右半肝切除治疗肝细胞癌的安全性及疗效,"符荣党, 陈焕伟, 王峰杰, 邓斐文, 李杰原, 麦结珍, 张晓红",2020,06,09,https://zhgzwkssxdzzz.cma-cmc.com.cn//CN/article/downloadArticleFile.do?attachType=PDF&id=18166
18167,TACE联合RFA治疗BCLC中晚期肝癌患者预后的影响因素分析,"李一帆, 顾俊鹏, 纪卫政, 张海潇, 朱帝文, 任伟新",2020,06,09,https://zhgzwkssxdzzz.cma-cmc.com.cn//CN/article/downloadArticleFile.do?attachType=PDF&id=18167
18168,三维可视化技术在半肝离断面设计中的误差分析,"谭凯, 杜锡林, 陈安, 贺小军, 杨振宇, 赵首捷",2020,06,09,https://zhgzwkssxdzzz.cma-cmc.com.cn//CN/article/downloadArticleFile.do?attachType=PDF&id=18168
18169,3D腹腔镜在肝泡型包虫病治疗中的应用价值,"马建雄, 段帅, 吐尔干艾力·阿吉, 冉博, 郭强, 蒋铁民, 邵英梅",2020,06,09,https://zhgzwkssxdzzz.cma-cmc.com.cn//CN/article/downloadArticleFile.do?attachType=PDF&id=18169
18170,急诊腹腔镜手术治疗儿童肝囊型包虫病破裂的应用价值,"玉苏甫·阿克木, 阿布都赛米·阿布都热衣木, 秦双利, 叶尔番, 和军, 李凯, 刘东, 阿孜古丽, 周玲, 李水学, 克力木",2020,06,09,https://zhgzwkssxdzzz.cma-cmc.com.cn//CN/article/downloadArticleFile.do?attachType=PDF&id=18170
18171,腹腔镜开窗术治疗非寄生虫性肝囊肿,"曲吉汇, 李宁, 隋晓军, 李明, 陈震",2020,06,09,https://zhgzwkssxdzzz.cma-cmc.com.cn//CN/article/downloadArticleFile.do?attachType=PDF&id=18171
18172,EmprintTM微波消融系统在肝细胞癌治疗中的安全性及疗效,"张小丹, 叶火林, 苏雅婷, 曾庆劲, 贺需旗, 李凯, 郑荣琴, 许尔蛟",2020,06,09,https://zhgzwkssxdzzz.cma-cmc.com.cn//CN/article/downloadArticleFile.do?attachType=PDF&id=18172
18173,脾动脉先行的五步法腹腔镜脾切除治疗肝硬化门静脉高压症巨脾患者的安全性及疗效,"邬杰忠, 黄河, 熊志勇, 姚志成, 刘波",2020,06,09,https://zhgzwkssxdzzz.cma-cmc.com.cn//CN/article/downloadArticleFile.do?attachType=PDF&id=18173
18174,三维可视化联合3D腹腔镜超巨脾切除术（附视频）,"林锦裕, 罗旺, 陈瑞, 祝文, 杨剑",2020,06,09,https://zhgzwkssxdzzz.cma-cmc.com.cn//CN/article/downloadArticleFile.do?attachType=PDF&id=18174
18175,lncRNA-DUXAP9/DUXAP10表达与肝癌肝切除患者预后的关系,"朱倩, 侍超, 沈晶尧, 徐亮, 应杰, 胡立平",2020,06,09,https://zhgzwkssxdzzz.cma-cmc.com.cn//CN/article/downloadArticleFile.do?attachType=PDF&id=18175
18176,基于生物信息学研究IGFBP在肝癌中表达及其预后价值,"戴斌, 王再兴, 马丹丹, 金炜东, 张智勇, 王德盛",2020,06,09,https://zhgzwkssxdzzz.cma-cmc.com.cn//CN/article/downloadArticleFile.do?attachType=PDF&id=18176
18177,胆管内乳头状黏液性肿瘤一例,"李冉冉, 陈永艺, 周松",2020,06,09,https://zhgzwkssxdzzz.cma-cmc.com.cn//CN/article/downloadArticleFile.do?attachType=PDF&id=18177
18178,TSP-1/CD47信号轴在肝再生中的作用机制,"吴警, 吐尔洪江·吐逊",2020,06,09,https://zhgzwkssxdzzz.cma-cmc.com.cn//CN/article/downloadArticleFile.do?attachType=PDF&id=18178
18132,不可切除肝内胆管细胞癌诊疗策略,"吴军, 琴瀚姣, 盛基尧, 张学文",2021,01,10,https://zhgzwkssxdzzz.cma-cmc.com.cn//CN/article/downloadArticleFile.do?attachType=PDF&id=18132
18133,肝内胆管细胞癌的诊治,"赵晓飞, 栗光明",2021,01,10,https://zhgzwkssxdzzz.cma-cmc.com.cn//CN/article/downloadArticleFile.do?attachType=PDF&id=18133
18134,从病理学角度探讨肝门部胆管癌的治疗与预后,"张东, 李起, 张健, 耿智敏",2021,01,10,https://zhgzwkssxdzzz.cma-cmc.com.cn//CN/article/downloadArticleFile.do?attachType=PDF&id=18134
18135,胆囊癌免疫治疗现状与进展,"吴自友, 龚伟",2021,01,10,https://zhgzwkssxdzzz.cma-cmc.com.cn//CN/article/downloadArticleFile.do?attachType=PDF&id=18135
18136,胆道系统肿瘤的免疫治疗,"刘磊, 杜成友, 魏续福, 张密, 廖锐",2021,01,10,https://zhgzwkssxdzzz.cma-cmc.com.cn//CN/article/downloadArticleFile.do?attachType=PDF&id=18136
18137,T1、T2期胆囊癌手术方式选择,"滕达, 刘鹏, 耿智敏, 翟文龙, 邱应和, 宋天强, 何宇, 李敬东, 李升平, 汤朝晖, 巩鹏",2021,01,10,https://zhgzwkssxdzzz.cma-cmc.com.cn//CN/article/downloadArticleFile.do?attachType=PDF&id=18137
18138,肝门部胆管癌合并梗阻性黄疸患者术前胆道引流疗效分析,"顾海涛, 张金彦, 王兆文, 陈国庆, 徐军明",2021,01,10,https://zhgzwkssxdzzz.cma-cmc.com.cn//CN/article/downloadArticleFile.do?attachType=PDF&id=18138
18139,腹腔镜与开腹左半肝切除术治疗肝内胆管结石安全性和疗效比较Meta分析,"牛朝, 李波, 靳文帝, 王春晓, 李晓刚",2021,01,10,https://zhgzwkssxdzzz.cma-cmc.com.cn//CN/article/downloadArticleFile.do?attachType=PDF&id=18139
18140,Child-Pugh评分和ALBI分级对BCLC-B期肝癌生存预后预测价值比较,"赵首捷, 杨振宇, 雷世雄, 谭凯, 刘雷",2021,01,10,https://zhgzwkssxdzzz.cma-cmc.com.cn//CN/article/downloadArticleFile.do?attachType=PDF&id=18140
18141,载药微球栓塞联合索拉非尼治疗不可切除肝癌安全性和疗效,"曹耿飞, 张海潇, 顾俊鹏, 朱帝文, 鲍应军, 阿斯哈尔·哈斯木, 任伟新",2021,01,10,https://zhgzwkssxdzzz.cma-cmc.com.cn//CN/article/downloadArticleFile.do?attachType=PDF&id=18141
