article_id,title,author,year,issue,volume,pdf_url
26124,体外扩增外周血NK细胞对不同肿瘤细胞系的细胞毒作用,"蔡惠宁, 钱师宇, 陈伟材, 黄梦淳, 陈文捷, 卢建溪",2022,04,11,https://zhgzwkssxdzzz.cma-cmc.com.cn//CN/article/downloadArticleFile.do?attachType=PDF&id=26124
26125,磁锚定技术辅助腹腔镜肝左外叶切除术治疗肝血管瘤一例,"陶杰, 张苗苗, 杜磊, 白纪刚, 耿智敏, 吕毅, 严小鹏",2022,04,11,https://zhgzwkssxdzzz.cma-cmc.com.cn//CN/article/downloadArticleFile.do?attachType=PDF&id=26125
26126,三维可视化技术在肝脏枪击贯通伤中的应用：附一例报告,"谭凯, 杜锡林, 陈安",2022,04,11,https://zhgzwkssxdzzz.cma-cmc.com.cn//CN/article/downloadArticleFile.do?attachType=PDF&id=26126
26127,神经内分泌肿瘤肝转移诊治进展,"庄荣源, 周宇红",2022,04,11,https://zhgzwkssxdzzz.cma-cmc.com.cn//CN/article/downloadArticleFile.do?attachType=PDF&id=26127
24581,腹腔镜胆总管囊肿切除术,"张树彬, 刘建华, 徐晨",2022,04,11,https://zhgzwkssxdzzz.cma-cmc.com.cn//CN/article/downloadArticleFile.do?attachType=PDF&id=24581
26178,机器人手术在胰腺外科中的应用进展与争议,"罗文浩, 曹喆, 张太平",2022,05,11,https://zhgzwkssxdzzz.cma-cmc.com.cn//CN/article/downloadArticleFile.do?attachType=PDF&id=26178
26179,慢性胰腺炎外科治疗时机与策略,"隋宇航, 孙备",2022,05,11,https://zhgzwkssxdzzz.cma-cmc.com.cn//CN/article/downloadArticleFile.do?attachType=PDF&id=26179
26180,胰腺囊性肿瘤分型诊治及相关指南解读,"田孝东, 杨尹默",2022,05,11,https://zhgzwkssxdzzz.cma-cmc.com.cn//CN/article/downloadArticleFile.do?attachType=PDF&id=26180
26181,腹腔镜保留脾脏的胰体尾切除术,"周子建, 游嘉颖, 蔡云强, 彭兵",2022,05,11,https://zhgzwkssxdzzz.cma-cmc.com.cn//CN/article/downloadArticleFile.do?attachType=PDF&id=26181
26182,胰腺导管内乳头状黏液性肿瘤诊治与随访策略,"黄晓锐, 郭通, 张志威, 蔡茗, 郭欣怡, 王敏, 俞亚红",2022,05,11,https://zhgzwkssxdzzz.cma-cmc.com.cn//CN/article/downloadArticleFile.do?attachType=PDF&id=26182
26183,胰腺癌根治术患者围手术期新辅助治疗的安全性分析,"勾善淼, 殷涛, 熊炯炘, 杨明, 彭涛, 周伟, 王博, 王春友, 吴河水",2022,05,11,https://zhgzwkssxdzzz.cma-cmc.com.cn//CN/article/downloadArticleFile.do?attachType=PDF&id=26183
26184,改良内陷式胰肠吻合在胰十二指肠切除术中的应用,"李利平, 游意莹, 沈宁, 曹宏, 王艳玲",2022,05,11,https://zhgzwkssxdzzz.cma-cmc.com.cn//CN/article/downloadArticleFile.do?attachType=PDF&id=26184
26185,TIPS术后支架评估中的光谱CT最佳单能级图像研究,"汤朝晖, 张建生, 陈其龙, 邓薇薇, 王劲",2022,05,11,https://zhgzwkssxdzzz.cma-cmc.com.cn//CN/article/downloadArticleFile.do?attachType=PDF&id=26185
26186,深度学习算法结合三低技术在上腹部动脉CT血管造影中的应用,"张可, 张悦, 蒋伟, 郭月飞, 郭焯欣, 孟占鳌",2022,05,11,https://zhgzwkssxdzzz.cma-cmc.com.cn//CN/article/downloadArticleFile.do?attachType=PDF&id=26186
26187,集束化ERAS方案在肝移植术后恢复中的应用,"谷艳梅, 栗光明, 席双梅, 刘薪, 武秀莲, 王鑫, 金伯旬",2022,05,11,https://zhgzwkssxdzzz.cma-cmc.com.cn//CN/article/downloadArticleFile.do?attachType=PDF&id=26187
26188,血清肌酸激酶对肝癌肝切除患者缺血-再灌注损伤的预测价值,"朱任飞, 冯秋琪, 肖锋, 邱烽, 吴建军, 杨帆",2022,05,11,https://zhgzwkssxdzzz.cma-cmc.com.cn//CN/article/downloadArticleFile.do?attachType=PDF&id=26188
26189,ERAS理念下经皮经肝胆道镜碎石术治疗肝胆管结石病的疗效,"李晓杰, 刘立宝, 胡昆鹏, 刘波, 王庆亮",2022,05,11,https://zhgzwkssxdzzz.cma-cmc.com.cn//CN/article/downloadArticleFile.do?attachType=PDF&id=26189
26190,血管夹肝门阻断法在复杂腹腔镜左半肝切除术中的应用,"张成, 李畅, 钟凯航, 温耀鸿, 何国林, 蔡磊, 程远, 付顺军, 刘海燕, 潘明新",2022,05,11,https://zhgzwkssxdzzz.cma-cmc.com.cn//CN/article/downloadArticleFile.do?attachType=PDF&id=26190
26191,A-P-R三角解剖联合ICG荧光染色腹腔镜解剖性肝S5段切除术,"王鹏, 荣维淇, 张建, 潘国政, 吴凡, 王黎明, 吴健雄, 王宏光",2022,05,11,https://zhgzwkssxdzzz.cma-cmc.com.cn//CN/article/downloadArticleFile.do?attachType=PDF&id=26191
26192,三维重建在中晚期肝癌转化切除中的应用,"干宸鑫, 王兴, 潘耀振",2022,05,11,https://zhgzwkssxdzzz.cma-cmc.com.cn//CN/article/downloadArticleFile.do?attachType=PDF&id=26192
26193,胰腺神经内分泌肿瘤肝转移一例并文献复习,"李海征, 侯建存, 李俊杰, 蒋文涛, 张雅敏, 沈中阳",2022,05,11,https://zhgzwkssxdzzz.cma-cmc.com.cn//CN/article/downloadArticleFile.do?attachType=PDF&id=26193
26194,CDT1在肝细胞癌中的表达及其预后预测价值,"江哲龙, 陈小雨, 祖晓婷, 潘凡, 杜俊杰, 杨芳, 江艺, 吕立志",2022,05,11,https://zhgzwkssxdzzz.cma-cmc.com.cn//CN/article/downloadArticleFile.do?attachType=PDF&id=26194
26195,INHBA在肝细胞癌中的表达及临床意义,"陈保荣, 李玺, 王佳妮, 潘宇航",2022,05,11,https://zhgzwkssxdzzz.cma-cmc.com.cn//CN/article/downloadArticleFile.do?attachType=PDF&id=26195
26196,局部进展期胰腺癌综合治疗一例,"张继成, 赵过超, 张磊, 施晨晔, 吴莉莉, 王明亮, 张轶群, 刘凌晓, 纪元, 周宇红, 王单松, 楼文晖, 吴文川",2022,05,11,https://zhgzwkssxdzzz.cma-cmc.com.cn//CN/article/downloadArticleFile.do?attachType=PDF&id=26196
26197,急诊胰十二指肠切除联合扩大右半结肠切除术治疗腹腔内脏损伤一例经验总结,"王荇, 张楷, 詹峰, 沈振伟, 李凯",2022,05,11,https://zhgzwkssxdzzz.cma-cmc.com.cn//CN/article/downloadArticleFile.do?attachType=PDF&id=26197
26198,深度学习在肝癌诊疗中的研究进展,"倪海旭, 张宇泓, 张磊, 李汛",2022,05,11,https://zhgzwkssxdzzz.cma-cmc.com.cn//CN/article/downloadArticleFile.do?attachType=PDF&id=26198
25723,腹腔镜射频消融减瘤后切除巨大肝血管瘤,"卢攀, 申伟文, 漆瞻, 陈龙, 张志远, 张伟",2022,05,11,https://zhgzwkssxdzzz.cma-cmc.com.cn//CN/article/downloadArticleFile.do?attachType=PDF&id=25723
25724,荧光腹腔镜胆囊切除术,李乐,2022,05,11,https://zhgzwkssxdzzz.cma-cmc.com.cn//CN/article/downloadArticleFile.do?attachType=PDF&id=25724
26626,不可切除肝内胆管细胞癌转化治疗策略,"方诚, 夏勇, 沈锋",2022,06,11,https://zhgzwkssxdzzz.cma-cmc.com.cn//CN/article/downloadArticleFile.do?attachType=PDF&id=26626
26627,肝癌转化治疗,"周辉年, 李玉民",2022,06,11,https://zhgzwkssxdzzz.cma-cmc.com.cn//CN/article/downloadArticleFile.do?attachType=PDF&id=26627
26628,腹腔镜解剖性肝右后叶切除关键技术,"吴一飞, 尹新民",2022,06,11,https://zhgzwkssxdzzz.cma-cmc.com.cn//CN/article/downloadArticleFile.do?attachType=PDF&id=26628
26629,胆管癌手术治疗策略,"俞阳, 陶鹏先, 王博方, 汪学艳, 张爱群, 陈昊",2022,06,11,https://zhgzwkssxdzzz.cma-cmc.com.cn//CN/article/downloadArticleFile.do?attachType=PDF&id=26629
26630,医源性胆管损伤的修复时机,"刘文峥, 陈勇军",2022,06,11,https://zhgzwkssxdzzz.cma-cmc.com.cn//CN/article/downloadArticleFile.do?attachType=PDF&id=26630
26631,靶向和免疫治疗在肝细胞癌新辅助治疗中的应用,"傅仰楷, 严茂林",2022,06,11,https://zhgzwkssxdzzz.cma-cmc.com.cn//CN/article/downloadArticleFile.do?attachType=PDF&id=26631
26632,头背侧入路腹腔镜解剖性左半肝切除术治疗肝癌的安全性及有效性,"雷光林, 胡雄伟, 王森, 宋彪, 洪智贤",2022,06,11,https://zhgzwkssxdzzz.cma-cmc.com.cn//CN/article/downloadArticleFile.do?attachType=PDF&id=26632
26633,腹腔镜大肝癌切除术安全性及有效性评估,"黄华坤, 杨斌, 张起帆, 邓敬舵, 陈志, 程远",2022,06,11,https://zhgzwkssxdzzz.cma-cmc.com.cn//CN/article/downloadArticleFile.do?attachType=PDF&id=26633
26634,多模态影像技术在精准肝癌肝切除中的应用,"刘文瑛, 欧阳再兴, 朱剑华, 吴黎明, 谭勇, 宋灏, 朱玉珍, 黄从云",2022,06,11,https://zhgzwkssxdzzz.cma-cmc.com.cn//CN/article/downloadArticleFile.do?attachType=PDF&id=26634
26635,ICG荧光显像技术在肝癌腹腔镜肝切除术中应用的安全性及疗效,"胡宇, 马金良, 葛勇胜, 余继海, 张传海, 刘文斌, 荚卫东",2022,06,11,https://zhgzwkssxdzzz.cma-cmc.com.cn//CN/article/downloadArticleFile.do?attachType=PDF&id=26635
26636,合并高钠血症供肝在劈离式肝移植中的应用,"杨卿, 梁智星, 易述红, 易慧敏, 张彤, 傅斌生, 曾凯宁, 冯啸, 张英才, 姚嘉, 唐晖, 刘剑戎, 魏绪霞, 陈规划, 杨扬",2022,06,11,https://zhgzwkssxdzzz.cma-cmc.com.cn//CN/article/downloadArticleFile.do?attachType=PDF&id=26636
26637,儿童劈离式肝移植术后肝动脉血栓形成的预防策略,"曾凯宁, 杨卿, 易述红, 张彤, 傅斌生, 姚嘉, 冯啸, 杨扬",2022,06,11,https://zhgzwkssxdzzz.cma-cmc.com.cn//CN/article/downloadArticleFile.do?attachType=PDF&id=26637
26638,精准肝脏外科联合ERAS理念在复杂肝囊型包虫病手术中的应用,"玉苏甫卡迪尔·麦麦提尼加提, 孟塬, 巴合提·卡力甫, 依马木·阿布拉, 马志刚, 卢爽, 陈雄",2022,06,11,https://zhgzwkssxdzzz.cma-cmc.com.cn//CN/article/downloadArticleFile.do?attachType=PDF&id=26638
26639,加速康复外科理念指导腹腔镜肝巨大血管瘤剥除术疗效,"张树彬, 周新博, 胡子轩, 邢中强, 刘建华",2022,06,11,https://zhgzwkssxdzzz.cma-cmc.com.cn//CN/article/downloadArticleFile.do?attachType=PDF&id=26639
26640,循环肿瘤DNA对中国肝癌诊断价值的Meta分析,"潘欣婷, 蔡志雄, 陈耕, 董秀清, 刘小龙",2022,06,11,https://zhgzwkssxdzzz.cma-cmc.com.cn//CN/article/downloadArticleFile.do?attachType=PDF&id=26640
26641,血清学多参数Logistic回归模型对肝细胞癌的诊断价值,"陈家豪, 邝小红, 廖媛, 刘志欢, 陈忠城, 周文营",2022,06,11,https://zhgzwkssxdzzz.cma-cmc.com.cn//CN/article/downloadArticleFile.do?attachType=PDF&id=26641
26642,肝门部胆管癌术后患者预后影响因素：单中心160例分析,"房炯泽, 杨勇, 叶莹鹏, 朱宏达, 吴胜东, 陆才德",2022,06,11,https://zhgzwkssxdzzz.cma-cmc.com.cn//CN/article/downloadArticleFile.do?attachType=PDF&id=26642
26643,超声造影与MRI诊断肝泡型包虫病病灶生物学活性的一致性分析,"邓旭, 韩军伟, 王晶晶, 张灵强, 杨小周, 李钊, 王海久, 樊海宁, 吕明德, 阳丹才让",2022,06,11,https://zhgzwkssxdzzz.cma-cmc.com.cn//CN/article/downloadArticleFile.do?attachType=PDF&id=26643
26644,超声造影评估肝泡型包虫病微波消融治疗效果,"王晶晶, 邓旭, 张灵强, 黄汉生, 王海久, 樊海宁, 王金环, 吕明德, 阳丹才让",2022,06,11,https://zhgzwkssxdzzz.cma-cmc.com.cn//CN/article/downloadArticleFile.do?attachType=PDF&id=26644
26645,Em-cfDNA与超声造影对肝泡型包虫病的诊断价值,"王凯强, 王玉乐, 张灵强, 何少帅, 高颖, 王海久, 樊海宁, 吕明德, 阳丹才让",2022,06,11,https://zhgzwkssxdzzz.cma-cmc.com.cn//CN/article/downloadArticleFile.do?attachType=PDF&id=26645
26646,胆囊壁中罗-阿氏窦及罗-阿氏窦结石发生率和分布研究,"于一龙, 郭绍红, 张敏慧, 姚洁, 方洁",2022,06,11,https://zhgzwkssxdzzz.cma-cmc.com.cn//CN/article/downloadArticleFile.do?attachType=PDF&id=26646
26647,活体肝移植术后的小肝综合征,"刘琦, 史冀华, 张水军",2022,06,11,https://zhgzwkssxdzzz.cma-cmc.com.cn//CN/article/downloadArticleFile.do?attachType=PDF&id=26647
26648,基于影像组学模型预测肝癌微血管侵犯的研究进展,"何泰霖, 王峻峰, 晋云, 杨超, 胡苹苹",2022,06,11,https://zhgzwkssxdzzz.cma-cmc.com.cn//CN/article/downloadArticleFile.do?attachType=PDF&id=26648
26649,脾脏疾病腹腔镜手术治疗现状及围手术期管理,"王慧君, 卢俊杰, 郑卫华, 张俊晶",2022,06,11,https://zhgzwkssxdzzz.cma-cmc.com.cn//CN/article/downloadArticleFile.do?attachType=PDF&id=26649
26276,腹腔镜下活体供肝扩大左外叶切取,"王宁, 宋九林, 杨家印, 严律南, 吴泓, 蒋利",2022,06,11,https://zhgzwkssxdzzz.cma-cmc.com.cn//CN/article/downloadArticleFile.do?attachType=PDF&id=26276
26277,在体完全左右半肝劈离术,"易述红, 杨卿",2022,06,11,https://zhgzwkssxdzzz.cma-cmc.com.cn//CN/article/downloadArticleFile.do?attachType=PDF&id=26277
27196,大数据和人工智能在原发性肝癌筛查与诊断中的应用,"刘红枝, 刘景丰",2023,01,12,https://zhgzwkssxdzzz.cma-cmc.com.cn//CN/article/downloadArticleFile.do?attachType=PDF&id=27196
27197,胰腺神经内分泌肿瘤肝转移术前评估和外科治疗策略,"吴峻立, 苗毅",2023,01,12,https://zhgzwkssxdzzz.cma-cmc.com.cn//CN/article/downloadArticleFile.do?attachType=PDF&id=27197
27198,肝癌转化治疗后外科切除的必要性和手术时机,元云飞,2023,01,12,https://zhgzwkssxdzzz.cma-cmc.com.cn//CN/article/downloadArticleFile.do?attachType=PDF&id=27198
27199,数字医学技术在肝脏分段及解剖性肝切除中的应用现状,"王祎, 王峻峰, 杨超, 晋云, 胡苹苹",2023,01,12,https://zhgzwkssxdzzz.cma-cmc.com.cn//CN/article/downloadArticleFile.do?attachType=PDF&id=27199
27200,肝细胞癌早期诊断和筛查,"丁成明, 侯嘉丰, 陶光伟, 齐硕, 谢翼, 冯灿, 陈振坤, 蒋心渺, 邓鑫, 彭健",2023,01,12,https://zhgzwkssxdzzz.cma-cmc.com.cn//CN/article/downloadArticleFile.do?attachType=PDF&id=27200
27201,肝细胞癌自发性破裂出血危险因素及预测模型研究现状,"王小兵, 邓卓凡, 龚建平",2023,01,12,https://zhgzwkssxdzzz.cma-cmc.com.cn//CN/article/downloadArticleFile.do?attachType=PDF&id=27201
27202,ICG荧光影像技术在腹腔镜精准肝段切除术中的应用,"周毅, 王一帆, 马金良, 余继海, 张传海",2023,01,12,https://zhgzwkssxdzzz.cma-cmc.com.cn//CN/article/downloadArticleFile.do?attachType=PDF&id=27202
27203,ICG荧光融合影像技术在肝癌腹腔镜解剖性肝切除术中的应用,"唐啸, 岳志强, 蔡卫华, 陈琳, 居林玲, 袁吉祥, 赵江华, 吴金柱",2023,01,12,https://zhgzwkssxdzzz.cma-cmc.com.cn//CN/article/downloadArticleFile.do?attachType=PDF&id=27203
27204,ERAS理念下腹腔镜精准肝切除在肝血管瘤治疗中的应用,"李业荣, 王涛, 汪新天, 陈晨",2023,01,12,https://zhgzwkssxdzzz.cma-cmc.com.cn//CN/article/downloadArticleFile.do?attachType=PDF&id=27204
27205,超声引导经皮热消融治疗邻近心脏的肝脏恶性肿瘤疗效分析,"曾庆劲, 赵里汶, 吴宇轩, 贺需旗, 张兰霞, 余萱, 何娜, 郑荣琴, 李凯",2023,01,12,https://zhgzwkssxdzzz.cma-cmc.com.cn//CN/article/downloadArticleFile.do?attachType=PDF&id=27205
27206,仑伐替尼、PD-1抑制剂联合肝动脉栓塞灌注化疗治疗不可切除肝癌疗效,"杨宇光, 唐辉, 谭志明, 麦聪, 陈铁军, 唐云强",2023,01,12,https://zhgzwkssxdzzz.cma-cmc.com.cn//CN/article/downloadArticleFile.do?attachType=PDF&id=27206
27207,基于SEER数据库构建早期肝内胆管细胞癌预后Nomogram模型,"王建磊, 马德林, 靳斌",2023,01,12,https://zhgzwkssxdzzz.cma-cmc.com.cn//CN/article/downloadArticleFile.do?attachType=PDF&id=27207
27208,腹腔镜胆总管探查一期缝合在正常直径胆总管结石患者中的应用,"冯其柱, 王思雨, 袁文康, 张超",2023,01,12,https://zhgzwkssxdzzz.cma-cmc.com.cn//CN/article/downloadArticleFile.do?attachType=PDF&id=27208
27209,胆总管一期缝合在腹腔镜联合胆道镜治疗胆囊结石合并胆总管结石中的应用,"姚礼, 吴金秀, 唐流康, 谢峰",2023,01,12,https://zhgzwkssxdzzz.cma-cmc.com.cn//CN/article/downloadArticleFile.do?attachType=PDF&id=27209
27210,磁锚定两孔法腹腔镜胆囊切除术学习曲线分析,"张苗苗, 雷蕾, 徐庶钦, 冒健骐, 白纪刚, 耿智敏, 吕毅, 严小鹏",2023,01,12,https://zhgzwkssxdzzz.cma-cmc.com.cn//CN/article/downloadArticleFile.do?attachType=PDF&id=27210
27211,术前胆道引流对壶腹周围癌患者术后并发症和远期生存的影响,"武帅, 吴含雪, 莫建涛, 杨沛泽, 程亚丽, 仵正",2023,01,12,https://zhgzwkssxdzzz.cma-cmc.com.cn//CN/article/downloadArticleFile.do?attachType=PDF&id=27211
27212,人工控制性胆道加压注水在复杂肝胆管结石经皮经肝胆道镜取石术中的应用,"李嘉, 李雄",2023,01,12,https://zhgzwkssxdzzz.cma-cmc.com.cn//CN/article/downloadArticleFile.do?attachType=PDF&id=27212
27213,胆囊息肉流行病学调查及其进展影响因素分析,"张海森, 叶金宝, 高鹏飞",2023,01,12,https://zhgzwkssxdzzz.cma-cmc.com.cn//CN/article/downloadArticleFile.do?attachType=PDF&id=27213
27214,腹腔镜脾部分切除术在脾脏良性占位性病变中的应用价值,"李硕, 周金婵, 李宇, 王卫东",2023,01,12,https://zhgzwkssxdzzz.cma-cmc.com.cn//CN/article/downloadArticleFile.do?attachType=PDF&id=27214
27215,供肝免冲洗灌注的大鼠肝移植实验研究,"卢强, 杨丽斐, 刘康, 余佳薇, 任璐, 张谞丰, 吕毅",2023,01,12,https://zhgzwkssxdzzz.cma-cmc.com.cn//CN/article/downloadArticleFile.do?attachType=PDF&id=27215
27216,miR-4458靶向结合BZW2对肝癌细胞增殖、迁移和侵袭的影响,"魏志鸿, 郭娟, 江哲龙, 江艺, 吕立志",2023,01,12,https://zhgzwkssxdzzz.cma-cmc.com.cn//CN/article/downloadArticleFile.do?attachType=PDF&id=27216
27217,腹腔镜超声引导下微波消融术在结直肠癌肝转移中的应用,"杨豆, 晋云, 王峻峰, 胡苹苹, 杨超, 韦翔曦",2023,01,12,https://zhgzwkssxdzzz.cma-cmc.com.cn//CN/article/downloadArticleFile.do?attachType=PDF&id=27217
27218,营养指标在肝细胞癌患者预后预测中的价值,"董明明, 王志鑫, 赵乾, 张东, 尹凤娇, 李玮, 王海久",2023,01,12,https://zhgzwkssxdzzz.cma-cmc.com.cn//CN/article/downloadArticleFile.do?attachType=PDF&id=27218
26831,腹腔镜胰十二指肠切除术胰管支架分离式外引流,"饶雪峰, 黄长文, 龚帅昌, 殷俊翔, 曹振军",2023,01,12,https://zhgzwkssxdzzz.cma-cmc.com.cn//CN/article/downloadArticleFile.do?attachType=PDF&id=26831
26832,腹腔镜肝S5背侧段+ S6切除术,"周后平, 欧廷政, 尚铭明, 姚本能, 宋新",2023,01,12,https://zhgzwkssxdzzz.cma-cmc.com.cn//CN/article/downloadArticleFile.do?attachType=PDF&id=26832
27906,重视胆道恶性肿瘤化疗联合靶向免疫的综合治疗,"王健东, 全志伟",2023,02,12,https://zhgzwkssxdzzz.cma-cmc.com.cn//CN/article/downloadArticleFile.do?attachType=PDF&id=27906
27907,胆管损伤修复后再狭窄原因与处理,"王向, 张永杰",2023,02,12,https://zhgzwkssxdzzz.cma-cmc.com.cn//CN/article/downloadArticleFile.do?attachType=PDF&id=27907
27908,胆囊癌外科规范治疗的难点与焦点,"王坚, 杨传鑫",2023,02,12,https://zhgzwkssxdzzz.cma-cmc.com.cn//CN/article/downloadArticleFile.do?attachType=PDF&id=27908
27909,胆囊癌肝切除范围再认识,"杨新伟, 杨平华, 闫兴州, 邢相磊, 刘虎, 赵永洋, 张克诚, 张宝华",2023,02,12,https://zhgzwkssxdzzz.cma-cmc.com.cn//CN/article/downloadArticleFile.do?attachType=PDF&id=27909
27910,胆囊癌临床分型研究现状及进展,"张东, 耿智敏, 全志伟",2023,02,12,https://zhgzwkssxdzzz.cma-cmc.com.cn//CN/article/downloadArticleFile.do?attachType=PDF&id=27910
27911,胆管癌局部治疗技术应用进展,"李卓群, 任冯刚, 王荣峰, 张东, 耿智敏, 吕毅, 仵正",2023,02,12,https://zhgzwkssxdzzz.cma-cmc.com.cn//CN/article/downloadArticleFile.do?attachType=PDF&id=27911
27912,肝门部胆管癌术前减黄及其对手术安全性的影响,"单季军, 李相成",2023,02,12,https://zhgzwkssxdzzz.cma-cmc.com.cn//CN/article/downloadArticleFile.do?attachType=PDF&id=27912
27913,免疫治疗在胆道肿瘤中的应用现状及展望,"蔡晨, 龚伟",2023,02,12,https://zhgzwkssxdzzz.cma-cmc.com.cn//CN/article/downloadArticleFile.do?attachType=PDF&id=27913
27914,劈离式肝移植血管分割与重建中国专家共识,"中华医学会外科学分会外科手术学学组, 中华医学会外科学分会移植学组, 华南劈离式肝移植联盟",2023,02,12,https://zhgzwkssxdzzz.cma-cmc.com.cn//CN/article/downloadArticleFile.do?attachType=PDF&id=27914
27915,胆囊癌临床分型的合理性及其与预后关系——单中心486例分析,"付佳禄, 张景玮, 金哲川, 张东, 耿智敏",2023,02,12,https://zhgzwkssxdzzz.cma-cmc.com.cn//CN/article/downloadArticleFile.do?attachType=PDF&id=27915
27916,胆囊癌根治性切除术后复发影响因素及列线图预测模型构建,"谭涛, 胡志刚, 周兵海, 吴华俊, 余新, 袁荣发, 邹书兵, 王恺",2023,02,12,https://zhgzwkssxdzzz.cma-cmc.com.cn//CN/article/downloadArticleFile.do?attachType=PDF&id=27916
27917,基于生物信息学分析构建肝内胆管细胞癌患者铁死亡相关lncRNA预后模型,"莫建涛, 杨沛泽, 曹瑞奇, 马清涌, 王铮, 仵正, 周灿灿",2023,02,12,https://zhgzwkssxdzzz.cma-cmc.com.cn//CN/article/downloadArticleFile.do?attachType=PDF&id=27917
27918,经动脉放疗栓塞术治疗不可切除肝内胆管细胞癌疗效与安全性Meta分析,"吴添庆, 王炯亮, 郑梽楷, 李文轩, 周仲国",2023,02,12,https://zhgzwkssxdzzz.cma-cmc.com.cn//CN/article/downloadArticleFile.do?attachType=PDF&id=27918
27919,基于术前检测指标构建Logistic回归模型在预测壶腹周围癌病理类型中的价值,"王琦琦, 龚梦元, 冯正源, 韩亮, 王铮, 马清涌, 仵正",2023,02,12,https://zhgzwkssxdzzz.cma-cmc.com.cn//CN/article/downloadArticleFile.do?attachType=PDF&id=27919
27920,一期与二期经皮经肝胆道镜取石术治疗中国肝内胆管结石患者安全性与疗效比较Meta分析,"涂建华, 史亚波, 李杨, 刘华兵, 黄长文, 饶雪峰",2023,02,12,https://zhgzwkssxdzzz.cma-cmc.com.cn//CN/article/downloadArticleFile.do?attachType=PDF&id=27920
27921,复发性肝内胆管结石患者术后T管延迟拔除影响因素预测模型构建,"李子寒, 濮天, 陈江明, 郭旗, 蒋东, 陈子祥, 刘付宝",2023,02,12,https://zhgzwkssxdzzz.cma-cmc.com.cn//CN/article/downloadArticleFile.do?attachType=PDF&id=27921
27922,血栓弹力图测定对远端胆管癌胰十二指肠切除术后出血的预测价值,"李杰, 任加强, 马坚, 王铮, 马清涌, 仵正",2023,02,12,https://zhgzwkssxdzzz.cma-cmc.com.cn//CN/article/downloadArticleFile.do?attachType=PDF&id=27922
27923,ERCP在胆胰疾病微创治疗中的有效性及安全性,"郭世龙, 杨潇, 胡欢欢, 杨梁, 周文富, 丛魁武, 张雨胜, 李英锋",2023,02,12,https://zhgzwkssxdzzz.cma-cmc.com.cn//CN/article/downloadArticleFile.do?attachType=PDF&id=27923
27924,十二指肠侧视镜引导下ERCP在消化道重建术后胆胰疾病治疗中的应用,"郝杰, 李宇, 陈晨, 杨雪, 陶杰, 王铮, 董鼎辉, 仵正, 孙昊",2023,02,12,https://zhgzwkssxdzzz.cma-cmc.com.cn//CN/article/downloadArticleFile.do?attachType=PDF&id=27924
27925,生物信息学分析前折叠蛋白家族在肝细胞癌中的表达及临床意义,"李福平, 王茂, 程瑞, 李尚朋, 代引海",2023,02,12,https://zhgzwkssxdzzz.cma-cmc.com.cn//CN/article/downloadArticleFile.do?attachType=PDF&id=27925
27926,残余左肝管内乳头状黏液瘤一例报告,"杨传鑫, 王伟, 王坚",2023,02,12,https://zhgzwkssxdzzz.cma-cmc.com.cn//CN/article/downloadArticleFile.do?attachType=PDF&id=27926
27927,N6-甲基腺苷表观转录组学在原发性肝癌中的研究进展,"杨小周, 赵华栋",2023,02,12,https://zhgzwkssxdzzz.cma-cmc.com.cn//CN/article/downloadArticleFile.do?attachType=PDF&id=27927
27928,肝细胞癌NK细胞及其相关免疫治疗研究进展,"谭天华, 宋京海",2023,02,12,https://zhgzwkssxdzzz.cma-cmc.com.cn//CN/article/downloadArticleFile.do?attachType=PDF&id=27928
27929,腹腔镜术中超声在肝胆胰外科中的应用进展,"韦翔曦, 晋云, 王峻峰, 胡苹苹, 杨超, 杨豆",2023,02,12,https://zhgzwkssxdzzz.cma-cmc.com.cn//CN/article/downloadArticleFile.do?attachType=PDF&id=27929
27290,腹腔镜左肝优先、原位模块化右半肝及全尾状叶切除术治疗肝右叶肝癌,"张树彬, 刘建华",2023,02,12,https://zhgzwkssxdzzz.cma-cmc.com.cn//CN/article/downloadArticleFile.do?attachType=PDF&id=27290
27291,腹腔镜左肝优先、原位模块化右半肝+全尾状叶切除术治疗肝门部胆管癌,"周宝勇, 莫林, 李明",2023,02,12,https://zhgzwkssxdzzz.cma-cmc.com.cn//CN/article/downloadArticleFile.do?attachType=PDF&id=27291
27292,腹腔镜解剖性肝Ⅶ+Ⅷ段切除治疗肝内胆管细胞癌,"曾新桃, 陈思瑞, 杨培, 罗华, 黄禹, 李超",2023,02,12,https://zhgzwkssxdzzz.cma-cmc.com.cn//CN/article/downloadArticleFile.do?attachType=PDF&id=27292
28457,基于Kupffer细胞特异性摄取的术中超声造影在肝脏外科中的应用,"许静涌, 宋京海",2023,03,12,https://zhgzwkssxdzzz.cma-cmc.com.cn//CN/article/downloadArticleFile.do?attachType=PDF&id=28457
28458,人工智能在肝细胞癌诊疗中的应用,"田亚, 吴美龙, 冯晓彬",2023,03,12,https://zhgzwkssxdzzz.cma-cmc.com.cn//CN/article/downloadArticleFile.do?attachType=PDF&id=28458
28459,基层医院开展腹腔镜肝脏手术的体会与思考,"刘丹峰, 荚卫东",2023,03,12,https://zhgzwkssxdzzz.cma-cmc.com.cn//CN/article/downloadArticleFile.do?attachType=PDF&id=28459
28460,腹腔镜肝脏手术中一些值得深入思考的问题,黄洁,2023,03,12,https://zhgzwkssxdzzz.cma-cmc.com.cn//CN/article/downloadArticleFile.do?attachType=PDF&id=28460
28461,基于卷积神经网络的肝细胞癌复发预警数字病理学模型研究,"孟锦雯, 刘治坤, 顾钰峰, 王建国, 杨帆, 郑树森, 徐骁",2023,03,12,https://zhgzwkssxdzzz.cma-cmc.com.cn//CN/article/downloadArticleFile.do?attachType=PDF&id=28461
