article_id,title,author,year,issue,volume,pdf_url
3371,微血管侵犯对小肝细胞癌和大肝细胞癌术后远期预后的影响,"白石磊, 杨平华, 李俊, 沈锋",2017,03,06,https://zhgzwkssxdzzz.cma-cmc.com.cn//CN/article/downloadArticleFile.do?attachType=PDF&id=3371
3372,结直肠癌肝转移射频消融与手术切除疗效比较,"周雪玲, 何晓兰, 蔡蕾, 黄江龙",2017,03,06,https://zhgzwkssxdzzz.cma-cmc.com.cn//CN/article/downloadArticleFile.do?attachType=PDF&id=3372
3373,全脾切除术与部分脾切除术对门静脉高压症脾功能亢进患者免疫功能影响的比较,"王永军, 罗大勇, 李恒, 张伟, 秦一雨, 罗志梅",2017,03,06,https://zhgzwkssxdzzz.cma-cmc.com.cn//CN/article/downloadArticleFile.do?attachType=PDF&id=3373
3374,分泌IGF-1的间充质干细胞对肝脏缺血-再灌注损伤的保护作用,"丁凡, 陈文捷, 汪国营, 冯啸, 唐晖, 许赤",2017,03,06,https://zhgzwkssxdzzz.cma-cmc.com.cn//CN/article/downloadArticleFile.do?attachType=PDF&id=3374
3375,人肝癌相关成纤维细胞与肝癌血管生成的相关性研究,"卢逸, 林楠, 陈之巨, 许瑞云",2017,03,06,https://zhgzwkssxdzzz.cma-cmc.com.cn//CN/article/downloadArticleFile.do?attachType=PDF&id=3375
3376,血清CD44V6、VEGF在大鼠结直肠癌肝转移诊断中的意义,"莫湘琼, 牛斌, 卜巨源, 吕宝军, 侯冰宗",2017,03,06,https://zhgzwkssxdzzz.cma-cmc.com.cn//CN/article/downloadArticleFile.do?attachType=PDF&id=3376
3377,全胰腺切除联合门静脉切除重建一例,"宋晓玲, 刘颖斌, 顾钧",2017,03,06,https://zhgzwkssxdzzz.cma-cmc.com.cn//CN/article/downloadArticleFile.do?attachType=PDF&id=3377
3378,腹腔镜脾切除技术演进与实践,"王广义, 蒋超",2017,04,06,https://zhgzwkssxdzzz.cma-cmc.com.cn//CN/article/downloadArticleFile.do?attachType=PDF&id=3378
3379,胰源性门静脉高压症的外科治疗现状,"吕新建, 孔瑞, 孙备",2017,04,06,https://zhgzwkssxdzzz.cma-cmc.com.cn//CN/article/downloadArticleFile.do?attachType=PDF&id=3379
3380,冠腔静脉分流术治疗门静脉高压症,"王瑞涛, 刘昌, 白纪刚, 董顺斌",2017,04,06,https://zhgzwkssxdzzz.cma-cmc.com.cn//CN/article/downloadArticleFile.do?attachType=PDF&id=3380
3381,重视胰源性门静脉高压症的诊治,"周尊强, 周光文",2017,04,06,https://zhgzwkssxdzzz.cma-cmc.com.cn//CN/article/downloadArticleFile.do?attachType=PDF&id=3381
3382,肝切除术后加速康复中国专家共识（2017版）,"中华医学会外科学分会外科手术学学组, 中国医疗保健国际交流促进会加速康复外科学分会肝脏外科学组",2017,04,06,https://zhgzwkssxdzzz.cma-cmc.com.cn//CN/article/downloadArticleFile.do?attachType=PDF&id=3382
3383,改良脾-肺固定术与断流术治疗门静脉高压症的疗效比较,"李路豪, 党晓卫, 李林, 刘优优, 付坤坤, 牛光辉, 李松, 许培钦",2017,04,06,https://zhgzwkssxdzzz.cma-cmc.com.cn//CN/article/downloadArticleFile.do?attachType=PDF&id=3383
3384,贲门周围血管离断术后并发症发生的影响因素分析,"刘阳, 赵耀, 黎一鸣, 陈熹, 刘清峰",2017,04,06,https://zhgzwkssxdzzz.cma-cmc.com.cn//CN/article/downloadArticleFile.do?attachType=PDF&id=3384
3385,血管切割闭合器五枪法前入路右半肝切除,"陈焕伟, 邓斐文, 胡健垣, 王峰杰, 李杰原",2017,04,06,https://zhgzwkssxdzzz.cma-cmc.com.cn//CN/article/downloadArticleFile.do?attachType=PDF&id=3385
3386,目标导向液体治疗在肝移植术后液体管理中的应用,"王文静, 郭波, 吕毅, 刘昌, 王博, 王铮, 张晓刚",2017,04,06,https://zhgzwkssxdzzz.cma-cmc.com.cn//CN/article/downloadArticleFile.do?attachType=PDF&id=3386
3387,射频消融与手术切除治疗早期肝细胞癌疗效比较Meta分析,"崔瑞文, 朱曙光, 范磊, 郑世杨, 李华",2017,04,06,https://zhgzwkssxdzzz.cma-cmc.com.cn//CN/article/downloadArticleFile.do?attachType=PDF&id=3387
3388,射频消融与手术切除治疗小肝细胞癌疗效比较,"刘猛, 季节, 李文奇",2017,04,06,https://zhgzwkssxdzzz.cma-cmc.com.cn//CN/article/downloadArticleFile.do?attachType=PDF&id=3388
3389,肝细胞癌肝切除术后出血的防治,"李清汉, 甄作均, 陈应军, 何尹韬",2017,04,06,https://zhgzwkssxdzzz.cma-cmc.com.cn//CN/article/downloadArticleFile.do?attachType=PDF&id=3389
3390,围手术期血浆输注对肝切除术后并发症影响及其相关因素,"卢强, 李青山, 张静, 任一凡, 张谞丰, 吕毅",2017,04,06,https://zhgzwkssxdzzz.cma-cmc.com.cn//CN/article/downloadArticleFile.do?attachType=PDF&id=3390
3391,多模式体温干预措施对原位肝移植患者围手术期低体温的影响,"张献玲, 张政, 罗刚健, 罗慧",2017,04,06,https://zhgzwkssxdzzz.cma-cmc.com.cn//CN/article/downloadArticleFile.do?attachType=PDF&id=3391
3392,合并肝硬化老年胆囊结石患者行腹腔镜胆囊切除术的临床疗效分析,"徐建, 杨刚, 权刚, 刘健, 张雨顺, 李敬东",2017,04,06,https://zhgzwkssxdzzz.cma-cmc.com.cn//CN/article/downloadArticleFile.do?attachType=PDF&id=3392
3393,快速康复外科在腹腔镜胆囊切除术围手术期应用的Meta分析,"梁豪, 熊志勇, 姚志成, 胡昆鹏, 李瑞曦, 周伯宣, 许瑞云, 邓美海",2017,04,06,https://zhgzwkssxdzzz.cma-cmc.com.cn//CN/article/downloadArticleFile.do?attachType=PDF&id=3393
3394,经腹腔镜超声引导下微波消融同期治疗结直肠癌肝转移疗效,"刁竞芳, 莫嘉强, 叶青, 刁德昌, 何军明",2017,04,06,https://zhgzwkssxdzzz.cma-cmc.com.cn//CN/article/downloadArticleFile.do?attachType=PDF&id=3394
3395,101例原发性胆汁性肝硬化患者的临床特征回顾性分析,"毕建斌, 李泽宇, 顾静娴, 苗润晨, 张佳, 杜肇清, 曲凯, 刘昌",2017,04,06,https://zhgzwkssxdzzz.cma-cmc.com.cn//CN/article/downloadArticleFile.do?attachType=PDF&id=3395
3396,熊去氧胆酸治疗原发性胆汁性肝硬化临床疗效的Meta分析,"顾静娴, 曲凯, 刘昌",2017,04,06,https://zhgzwkssxdzzz.cma-cmc.com.cn//CN/article/downloadArticleFile.do?attachType=PDF&id=3396
3397,18F-FDG PET/CT延迟显像在原发性肝癌诊断中的应用价值,"张峰, 谢良骏, 曹素娥, 查悦明, 程木华",2017,04,06,https://zhgzwkssxdzzz.cma-cmc.com.cn//CN/article/downloadArticleFile.do?attachType=PDF&id=3397
3398,IL-32γ活化Akt通路诱导肝星状细胞LX-2表达MMP2,"梁美莲, 陈小燕, 张凡, 潘兴飞",2017,04,06,https://zhgzwkssxdzzz.cma-cmc.com.cn//CN/article/downloadArticleFile.do?attachType=PDF&id=3398
3399,慢性炎症损伤在二乙基亚硝胺诱导大鼠肝细胞癌发生中的作用,"张昊, 李文, 陈署贤, 潘楚芝, 王楚斯, 潘卫东",2017,04,06,https://zhgzwkssxdzzz.cma-cmc.com.cn//CN/article/downloadArticleFile.do?attachType=PDF&id=3399
3400,原发性肝癌射频消融治疗,"李玉民, 马臻, 陈昊",2017,05,06,https://zhgzwkssxdzzz.cma-cmc.com.cn//CN/article/downloadArticleFile.do?attachType=PDF&id=3400
3401,浅谈肝细胞癌伴胆管癌栓的诊治现状,"张修平, 孙居仙, 王康, 程树群",2017,05,06,https://zhgzwkssxdzzz.cma-cmc.com.cn//CN/article/downloadArticleFile.do?attachType=PDF&id=3401
3402,肝细胞癌的免疫治疗现状与展望,"李汛, 刘小军, 严俊",2017,05,06,https://zhgzwkssxdzzz.cma-cmc.com.cn//CN/article/downloadArticleFile.do?attachType=PDF&id=3402
3403,Cantlie线的发现与联合肝脏离断和门静脉结扎的分阶段肝切除术,"施祥德, 刘超",2017,05,06,https://zhgzwkssxdzzz.cma-cmc.com.cn//CN/article/downloadArticleFile.do?attachType=PDF&id=3403
3404,肝门再次阻断法在预防肝切除术后胆漏中的价值,"马俊永, 张小峰, 闫振林, 王葵, 汪宇, 王文超, 严强, 沈锋, 施乐华, 李锡锋",2017,05,06,https://zhgzwkssxdzzz.cma-cmc.com.cn//CN/article/downloadArticleFile.do?attachType=PDF&id=3404
3405,预测HBV相关肝细胞癌肝切除术后肝衰竭列线图模型的建立,"李风伟, 雷正清, 张茜茜, 高瑜振, 夏勇, 李俊, 邹奇飞, 阎振林, 王葵",2017,05,06,https://zhgzwkssxdzzz.cma-cmc.com.cn//CN/article/downloadArticleFile.do?attachType=PDF&id=3405
3406,Endo-GIA两步法在腹腔镜左半肝切除术中的应用价值,"李梅生, 李清汉, 甄作均, 陈焕伟",2017,05,06,https://zhgzwkssxdzzz.cma-cmc.com.cn//CN/article/downloadArticleFile.do?attachType=PDF&id=3406
3407,全腹腔镜活体左外叶供肝切取两例,"沈丛欢, 陶一峰, 李瑞东, 张全保, 张晓飞, 陈进宏, 钦伦秀, 王正昕",2017,05,06,https://zhgzwkssxdzzz.cma-cmc.com.cn//CN/article/downloadArticleFile.do?attachType=PDF&id=3407
3408,联合肝脏离断和门静脉结扎的分阶段肝切除术治疗肝细胞癌,"谌小龙, 汪根树, 杨卿, 姜楠, 张俊斌, 王励, 李慧, 李华, 杨扬, 陈规划",2017,05,06,https://zhgzwkssxdzzz.cma-cmc.com.cn//CN/article/downloadArticleFile.do?attachType=PDF&id=3408
3409,快速康复外科理念在胆总管切开取石术围手术期应用疗效的Meta分析,"廖启成, 谢星, 王小农, 何晓, 李红春",2017,05,06,https://zhgzwkssxdzzz.cma-cmc.com.cn//CN/article/downloadArticleFile.do?attachType=PDF&id=3409
3410,半肝血流阻断在腹腔镜肝细胞癌切除中的应用,"何尹韬, 陈应军, 甄作均",2017,05,06,https://zhgzwkssxdzzz.cma-cmc.com.cn//CN/article/downloadArticleFile.do?attachType=PDF&id=3410
3411,切割球囊治疗肝移植术后胆管吻合口狭窄,"唐晖, 丁凡, 姜在波, 赵辉, 李华, 易述红, 杨扬, 陈规划, 许赤",2017,05,06,https://zhgzwkssxdzzz.cma-cmc.com.cn//CN/article/downloadArticleFile.do?attachType=PDF&id=3411
3412,罗哌卡因联合苏芬太尼镇痛加速肝硬化门静脉高压症患者肝切除术后康复,"王雪华, 张慧玲, 林楠, 钟跃思",2017,05,06,https://zhgzwkssxdzzz.cma-cmc.com.cn//CN/article/downloadArticleFile.do?attachType=PDF&id=3412
3413,肝移植术在原发性胆汁性肝硬化中的应用价值,"苗润晨, 曲凯, 李泽雨, 毕建斌, 顾静娴, 刘昌",2017,05,06,https://zhgzwkssxdzzz.cma-cmc.com.cn//CN/article/downloadArticleFile.do?attachType=PDF&id=3413
3414,经引流管腔道内超声造影在引流不畅肝脓肿中的应用,"张艳玲, 李凯, 郭欢仪, 苏中振, 许尔蛟, 郑荣琴",2017,05,06,https://zhgzwkssxdzzz.cma-cmc.com.cn//CN/article/downloadArticleFile.do?attachType=PDF&id=3414
3415,右美托咪啶麻醉诱导加速肝细胞癌切除术后麻醉恢复,"罗慧, 张献玲, 陈芳, 胡爱玲, 黄勇",2017,05,06,https://zhgzwkssxdzzz.cma-cmc.com.cn//CN/article/downloadArticleFile.do?attachType=PDF&id=3415
3416,磁压榨吻合技术在大鼠肝移植模型建立中的应用,"杨丽斐, 陆建文, 史源, 马涛, 董鼎辉, 吴荣谦, 吕毅",2017,05,06,https://zhgzwkssxdzzz.cma-cmc.com.cn//CN/article/downloadArticleFile.do?attachType=PDF&id=3416
3417,siRNA沉默CHI3L1基因对人胆囊癌细胞增殖及侵袭的影响,"付亮, 锁涛, 李敏, 宋陆军",2017,05,06,https://zhgzwkssxdzzz.cma-cmc.com.cn//CN/article/downloadArticleFile.do?attachType=PDF&id=3417
3418,肝紫癜病被误诊为肝细胞癌一例,"贺小军, 杨振宇, 杨涛, 谭凯, 杜锡林, 鲁建国",2017,05,06,https://zhgzwkssxdzzz.cma-cmc.com.cn//CN/article/downloadArticleFile.do?attachType=PDF&id=3418
3419,腹腔镜下Glisson鞘肝蒂解剖法右半肝切除：两例报道（附视频）,"余德才, 吴星宇, 颜晨, 丁义涛",2017,05,06,https://zhgzwkssxdzzz.cma-cmc.com.cn//CN/article/downloadArticleFile.do?attachType=PDF&id=3419
3420,肝细胞癌合并门静脉癌栓的多学科治疗策略,"郭荣平, 徐立, 韦玮, 陈敏山",2017,06,06,https://zhgzwkssxdzzz.cma-cmc.com.cn//CN/article/downloadArticleFile.do?attachType=PDF&id=3420
3421,动脉优先技术在胰头癌根治术中的应用,"秦仁义, 彭丰, 王敏, 朱峰, 何睿智, 赵炎",2017,06,06,https://zhgzwkssxdzzz.cma-cmc.com.cn//CN/article/downloadArticleFile.do?attachType=PDF&id=3421
3422,肺炎克雷伯菌性肝脓肿伴内源性眼内炎的诊断及治疗,"张自然, 孟凡征, 尹大龙, 刘连新",2017,06,06,https://zhgzwkssxdzzz.cma-cmc.com.cn//CN/article/downloadArticleFile.do?attachType=PDF&id=3422
3423,华支睾吸虫感染与胆管癌发病关系的研究进展,"冯铭彬, 刘超",2017,06,06,https://zhgzwkssxdzzz.cma-cmc.com.cn//CN/article/downloadArticleFile.do?attachType=PDF&id=3423
3424,肝细胞癌合并门静脉癌栓的外科治疗,"刘建平, 张克韬",2017,06,06,https://zhgzwkssxdzzz.cma-cmc.com.cn//CN/article/downloadArticleFile.do?attachType=PDF&id=3424
3425,原发性肝癌合并胆道出血的诊疗进展,"聂常富, 朱明辉",2017,06,06,https://zhgzwkssxdzzz.cma-cmc.com.cn//CN/article/downloadArticleFile.do?attachType=PDF&id=3425
3426,胆管癌的治疗现状,"陈昆仑, 翟文龙",2017,06,06,https://zhgzwkssxdzzz.cma-cmc.com.cn//CN/article/downloadArticleFile.do?attachType=PDF&id=3426
3427,腹腔镜胆囊切除术致变异右后叶胆管损伤的预防与处理,"王先法, 钟欣, 祝和攀, 顾利虎",2017,06,06,https://zhgzwkssxdzzz.cma-cmc.com.cn//CN/article/downloadArticleFile.do?attachType=PDF&id=3427
3428,肝切除术治疗医源性胆管损伤,"陈雄, 巴合提·卡力甫, 孟塬, 马志刚, 戈小虎",2017,06,06,https://zhgzwkssxdzzz.cma-cmc.com.cn//CN/article/downloadArticleFile.do?attachType=PDF&id=3428
3429,加速康复外科理念在外伤性肝破裂围手术期管理中的应用,"王理, 黄威, 李俐, 罗灿军, 方凌云, 金河, 王梦炎",2017,06,06,https://zhgzwkssxdzzz.cma-cmc.com.cn//CN/article/downloadArticleFile.do?attachType=PDF&id=3429
3430,389例肝门部胆管癌外科治疗回顾性分析——单中心11年经验总结,"张东, 李文智, 陶杰, 陈晨, 王林, 石磊, 孙昊, 刘青光, 吕毅, 刘昌, 仵正, 耿智敏",2017,06,06,https://zhgzwkssxdzzz.cma-cmc.com.cn//CN/article/downloadArticleFile.do?attachType=PDF&id=3430
3431,腹腔镜胆囊次全切除术在腹腔镜困难胆囊切除术中的应用,"李殿启, 刘栋, 李健, 赵晓光, 王浩",2017,06,06,https://zhgzwkssxdzzz.cma-cmc.com.cn//CN/article/downloadArticleFile.do?attachType=PDF&id=3431
3432,肝切除术后不放置腹腔引流管的安全性与有效性Meta分析,"雷秋成, 符荣党, 邓斐文, 胡健垣, 王峰杰, 李杰原, 陈焕伟",2017,06,06,https://zhgzwkssxdzzz.cma-cmc.com.cn//CN/article/downloadArticleFile.do?attachType=PDF&id=3432
3433,腹腔镜开窗引流联合无水乙醇灌注及双极电刀囊壁烧灼治疗肝囊肿,"胡健垣, 陈焕伟",2017,06,06,https://zhgzwkssxdzzz.cma-cmc.com.cn//CN/article/downloadArticleFile.do?attachType=PDF&id=3433
3434,肝包虫囊肿破裂的相关因素分析及疗效评价,"王瑞涛, 李庆, 梁欢, 万永, 董顺斌, 曲凯, 刘昌",2017,06,06,https://zhgzwkssxdzzz.cma-cmc.com.cn//CN/article/downloadArticleFile.do?attachType=PDF&id=3434
3435,CT血管造影在肝右叶活体肝移植术前供者肝静脉评估中价值,"张亚琴, 朱俊颖, 吕海金, 侯永和, 孟晓春",2017,06,06,https://zhgzwkssxdzzz.cma-cmc.com.cn//CN/article/downloadArticleFile.do?attachType=PDF&id=3435
3436,合并肝硬化的小肝内胆管细胞癌MRI强化特征分析和鉴别诊断,"伍路, 黄彬, 霍雷, 夏勇, 闫振林, 沈锋",2017,06,06,https://zhgzwkssxdzzz.cma-cmc.com.cn//CN/article/downloadArticleFile.do?attachType=PDF&id=3436
3437,多层螺旋CT在胆囊炎与肝病性胆囊改变鉴别诊断中的应用,"唐文才, 黄菁慧, 李传资, 聂忠仕, 王绥煌",2017,06,06,https://zhgzwkssxdzzz.cma-cmc.com.cn//CN/article/downloadArticleFile.do?attachType=PDF&id=3437
3438,海肾荧光素酶基因标记肝癌细胞生物发光成像在小鼠肝癌活体示踪中应用,"张丽娜, 李征然, 黄明声, 王劲, 郭若汨, 唐文杰",2017,06,06,https://zhgzwkssxdzzz.cma-cmc.com.cn//CN/article/downloadArticleFile.do?attachType=PDF&id=3438
3439,七氟醚预处理对糖尿病小鼠肝缺血-再灌注损伤的保护作用,"欧珊珊, 韩玉湘, 肖笑雨, 杨禄坤, 朱颖娴",2017,06,06,https://zhgzwkssxdzzz.cma-cmc.com.cn//CN/article/downloadArticleFile.do?attachType=PDF&id=3439
3440,肝脏胆管囊腺肿瘤的手术选择与治疗经验,"尹大龙, 刘连新, 姜洪池",2018,01,07,https://zhgzwkssxdzzz.cma-cmc.com.cn//CN/article/downloadArticleFile.do?attachType=PDF&id=3440
3441,重症患者继发硬化性胆管炎研究现状与进展,"田孝东, 杨尹默",2018,01,07,https://zhgzwkssxdzzz.cma-cmc.com.cn//CN/article/downloadArticleFile.do?attachType=PDF&id=3441
3442,肝内胆管囊腺癌的诊治进展,"宋世飞, 孙晓东, 骆飞翔, 樊钟琦, 吕国悦",2018,01,07,https://zhgzwkssxdzzz.cma-cmc.com.cn//CN/article/downloadArticleFile.do?attachType=PDF&id=3442
3443,慢性胰腺炎的外科治疗,"张翔, 廖泉",2018,01,07,https://zhgzwkssxdzzz.cma-cmc.com.cn//CN/article/downloadArticleFile.do?attachType=PDF&id=3443
3444,肝硬化门静脉高压症合并胆石症手术策略,"王志东, 蒋安, 李宗芳",2018,01,07,https://zhgzwkssxdzzz.cma-cmc.com.cn//CN/article/downloadArticleFile.do?attachType=PDF&id=3444
3445,肝硬化门静脉高压症干细胞移植治疗的研究现状,"林佳昀, 罗蒙",2018,01,07,https://zhgzwkssxdzzz.cma-cmc.com.cn//CN/article/downloadArticleFile.do?attachType=PDF&id=3445
3446,精准肝切除治疗肝内胆管结石,"陈浩, 荚卫东, 葛勇胜, 马金良, 余继海, 刘文斌, 张传海, 许戈良",2018,01,07,https://zhgzwkssxdzzz.cma-cmc.com.cn//CN/article/downloadArticleFile.do?attachType=PDF&id=3446
3447,腹腔镜胆总管探查术治疗胆管结石临床研究,"张煜, 张智勇, 仵晓荣, 海军, 耿西林, 郑伟, 常虎林, 杜立学",2018,01,07,https://zhgzwkssxdzzz.cma-cmc.com.cn//CN/article/downloadArticleFile.do?attachType=PDF&id=3447
3448,经皮经肝胆囊穿刺引流术在特殊人群急性结石性胆囊炎治疗中的应用,"祁军安, 李宗芳, 王志东, 王涛, 卢振华, 杨彦伟, 罗冬根, 马晓阳",2018,01,07,https://zhgzwkssxdzzz.cma-cmc.com.cn//CN/article/downloadArticleFile.do?attachType=PDF&id=3448
3449,三维可视化技术在巨块型肝细胞癌精准肝切除中的应用价值,"荚卫东, 陈浩, 葛勇胜, 马金良, 余继海, 刘文斌, 张传海, 许戈良",2018,01,07,https://zhgzwkssxdzzz.cma-cmc.com.cn//CN/article/downloadArticleFile.do?attachType=PDF&id=3449
3450,不包括胆囊切除的开腹胆道手术后手术部位感染的危险因素分析,"蔡文昌, 沈伟峰, 张蕾, 赵一军, 杨甲梅",2018,01,07,https://zhgzwkssxdzzz.cma-cmc.com.cn//CN/article/downloadArticleFile.do?attachType=PDF&id=3450
3451,局限性解剖性肝段切除治疗中央区大肝细胞癌,"李江, 刘斌, 蔡晓蓓",2018,01,07,https://zhgzwkssxdzzz.cma-cmc.com.cn//CN/article/downloadArticleFile.do?attachType=PDF&id=3451
3452,腹腔镜肝切除术治疗困难部位肝细胞癌的疗效,"刘钦钦, 胡逸凡, 刘非, 魏永刚, 李波",2018,01,07,https://zhgzwkssxdzzz.cma-cmc.com.cn//CN/article/downloadArticleFile.do?attachType=PDF&id=3452
3453,增强CT及增强MRI图像融合技术在原发性肝癌治疗决策中的价值,"唐建信, 李星, 邢艳芳, 刘尚鑫, 吴晨飞, 江文钊, 陈明, 莫嘉辉, 吴伟坤, 吴祥元, 姜楠",2018,01,07,https://zhgzwkssxdzzz.cma-cmc.com.cn//CN/article/downloadArticleFile.do?attachType=PDF&id=3453
3454,完全3D腹腔镜胰十二指肠切除术治疗壶腹癌,"郑逸锋, 唐小波, 李威",2018,01,07,https://zhgzwkssxdzzz.cma-cmc.com.cn//CN/article/downloadArticleFile.do?attachType=PDF&id=3454
3455,肝血管肉瘤误诊为肝腺瘤的原因分析并文献复习,"项灯, 刘刚, 熊振芳, 李剑锋, 艾军华, 时军",2018,01,07,https://zhgzwkssxdzzz.cma-cmc.com.cn//CN/article/downloadArticleFile.do?attachType=PDF&id=3455
3456,肝硬化患者肝移植术后静息态下脑功能局部一致性变化,"李玲, 林武生, 陈规划, 韩洪瀛",2018,01,07,https://zhgzwkssxdzzz.cma-cmc.com.cn//CN/article/downloadArticleFile.do?attachType=PDF&id=3456
3457,载脂蛋白F在肝细胞癌患者生存预后中的临床意义,"周伯宣, 姚志成, 熊志勇, 李瑞曦, 代天星, 许明星, 范伟明, 周正, 梁豪, 邓美海, 凌云彪",2018,01,07,https://zhgzwkssxdzzz.cma-cmc.com.cn//CN/article/downloadArticleFile.do?attachType=PDF&id=3457
3458,耐药基因蛋白和Ki67在原发性肝癌中的表达及其在预后中的价值,"郭飞宇, 杨军, 熊书名, 高森, 朱茂群, 李建平",2018,01,07,https://zhgzwkssxdzzz.cma-cmc.com.cn//CN/article/downloadArticleFile.do?attachType=PDF&id=3458
3459,miR-548j-5p表达对胰腺癌侵袭能力的影响,"何睿智, 彭丰, 冯业晨, 郭兴军, 李旭, 王敏, 田锐, 朱峰, 秦仁义",2018,01,07,https://zhgzwkssxdzzz.cma-cmc.com.cn//CN/article/downloadArticleFile.do?attachType=PDF&id=3459
3460,腹腔镜胰十二指肠切除术难点与对策,"钱振渊, 周育成, 牟一平",2018,02,07,https://zhgzwkssxdzzz.cma-cmc.com.cn//CN/article/downloadArticleFile.do?attachType=PDF&id=3460
3461,胰腺癌个体化诊治,"陈汝福, 林青",2018,02,07,https://zhgzwkssxdzzz.cma-cmc.com.cn//CN/article/downloadArticleFile.do?attachType=PDF&id=3461
3462,脾功能亢进常见原因及治疗策略,"蒋安, 李宗芳",2018,02,07,https://zhgzwkssxdzzz.cma-cmc.com.cn//CN/article/downloadArticleFile.do?attachType=PDF&id=3462
3463,肝癌血流动力学改变及其意义,许戈良,2018,02,07,https://zhgzwkssxdzzz.cma-cmc.com.cn//CN/article/downloadArticleFile.do?attachType=PDF&id=3463
3464,TIPS治疗食管胃底静脉曲张破裂出血长期疗效的影响因素,"何长生, 吴性江",2018,02,07,https://zhgzwkssxdzzz.cma-cmc.com.cn//CN/article/downloadArticleFile.do?attachType=PDF&id=3464
3465,胰腺外科术后加速康复的实践,吴文川,2018,02,07,https://zhgzwkssxdzzz.cma-cmc.com.cn//CN/article/downloadArticleFile.do?attachType=PDF&id=3465
3466,全腹腔镜Ⅳ型肝门部胆管癌根治术的临床应用价值（附视频）,"尹新民, 刘雅玲, 成伟, 吴一飞, 刘毅, 朱斯维, 廖春红",2018,02,07,https://zhgzwkssxdzzz.cma-cmc.com.cn//CN/article/downloadArticleFile.do?attachType=PDF&id=3466
3467,肝内胆管结石合并胆管癌诊治经验,"徐建, 李敬东",2018,02,07,https://zhgzwkssxdzzz.cma-cmc.com.cn//CN/article/downloadArticleFile.do?attachType=PDF&id=3467
3468,腹腔镜联合胆道镜再次胆总管探查在肝内外胆管结石患者中的应用价值,"李敏, 陶颖, 宋陆军",2018,02,07,https://zhgzwkssxdzzz.cma-cmc.com.cn//CN/article/downloadArticleFile.do?attachType=PDF&id=3468
3469,内镜下乳头括约肌切开术中出血的治疗,"王闯, 周晓华, 姚金科, 刘建平",2018,02,07,https://zhgzwkssxdzzz.cma-cmc.com.cn//CN/article/downloadArticleFile.do?attachType=PDF&id=3469
3470,ALPPS在肝泡型包虫病中的应用,"王瑞涛, 刘昌, 张晓刚, 万永, 曲凯, 顾静娴, 郝万静",2018,02,07,https://zhgzwkssxdzzz.cma-cmc.com.cn//CN/article/downloadArticleFile.do?attachType=PDF&id=3470
3471,髂动脉搭桥Meso-Rex术治疗原发性门静脉海绵样变性,"沙地克·阿帕尔, 吐尔洪江·吐逊, 姚刚, 江多斯·帕依孜吾拉, 张皓, 赵晋明, 李涛",2018,02,07,https://zhgzwkssxdzzz.cma-cmc.com.cn//CN/article/downloadArticleFile.do?attachType=PDF&id=3471
3472,术后预后营养指数在肝细胞癌患者预后中的价值,"梁荣朴, 叶林森, 张杰滨, 汪国营, 陈规划",2018,02,07,https://zhgzwkssxdzzz.cma-cmc.com.cn//CN/article/downloadArticleFile.do?attachType=PDF&id=3472
3473,大范围肝切除术后肝衰竭危险因素分析,"曾柏强, 吴祥, 冉义洪, 罗旋, 张红卫",2018,02,07,https://zhgzwkssxdzzz.cma-cmc.com.cn//CN/article/downloadArticleFile.do?attachType=PDF&id=3473
3474,端粒酶调控因子PinX1抑制肝癌细胞增殖与侵袭,"李瑞曦, 姚志成, 熊志勇, 周伯宣, 徐见亮, 胡昆鹏, 范伟明, 梁豪, 邓美海",2018,02,07,https://zhgzwkssxdzzz.cma-cmc.com.cn//CN/article/downloadArticleFile.do?attachType=PDF&id=3474
3475,miR-17-5p通过靶向作用AKT3抑制肝癌侵袭和迁移,"孔伟浩, 李坤, 肖翠翠, 胡竞雄, 黄泽楠, 陈强星, 张剑",2018,02,07,https://zhgzwkssxdzzz.cma-cmc.com.cn//CN/article/downloadArticleFile.do?attachType=PDF&id=3475
3476,器官移植术后供体来源细胞游离DNA监测的研究进展,"吕耀辉, 张水军",2018,02,07,https://zhgzwkssxdzzz.cma-cmc.com.cn//CN/article/downloadArticleFile.do?attachType=PDF&id=3476
3477,Hippo-YAP信号通路与HBx交联机制在肝细胞癌中的研究进展,"崔瑞文, 李华",2018,02,07,https://zhgzwkssxdzzz.cma-cmc.com.cn//CN/article/downloadArticleFile.do?attachType=PDF&id=3477
3478,肝移植术后并发癫痫的研究进展,"吕程威, 张水军",2018,02,07,https://zhgzwkssxdzzz.cma-cmc.com.cn//CN/article/downloadArticleFile.do?attachType=PDF&id=3478
3479,全腹腔镜前入路绕肝提拉法右半肝切除术（附视频）,"陈焕伟, 邓斐文, 李杰原",2018,02,07,https://zhgzwkssxdzzz.cma-cmc.com.cn//CN/article/downloadArticleFile.do?attachType=PDF&id=3479
3480,非酒精性脂肪性肝病相关肝细胞癌临床特征与发病机制研究进展,"肖永胜, 周俭",2018,03,07,https://zhgzwkssxdzzz.cma-cmc.com.cn//CN/article/downloadArticleFile.do?attachType=PDF&id=3480
3481,长链非编码RNA在肝移植中的应用,"杨兆伟, 张水军",2018,03,07,https://zhgzwkssxdzzz.cma-cmc.com.cn//CN/article/downloadArticleFile.do?attachType=PDF&id=3481
3482,多镜联合治疗复杂胆道结石的难点与要点,"尚东, 张庆凯, 张桂信",2018,03,07,https://zhgzwkssxdzzz.cma-cmc.com.cn//CN/article/downloadArticleFile.do?attachType=PDF&id=3482
3483,内镜下鼻胆管引流术在复杂肝外胆管结石中的应用体会,"周华丁, 王一飞, 王正昕",2018,03,07,https://zhgzwkssxdzzz.cma-cmc.com.cn//CN/article/downloadArticleFile.do?attachType=PDF&id=3483
3484,肝脏切除手术的快速康复外科方案,"武晓琳, 张磊",2018,03,07,https://zhgzwkssxdzzz.cma-cmc.com.cn//CN/article/downloadArticleFile.do?attachType=PDF&id=3484
3485,经皮经肝胆道镜碎石三维可视化研究进展,"陈琪龙, 王小忠",2018,03,07,https://zhgzwkssxdzzz.cma-cmc.com.cn//CN/article/downloadArticleFile.do?attachType=PDF&id=3485
