article_id,title,author,year,issue,volume,pdf_url
12062,医学修复学——现代医学重要支撑学科,"黄红云, 冯世庆, 陈琳, 毛更生, 郑遵成",2017,01,07,https://zhxbygxbzz.cma-cmc.com.cn//CN/article/downloadArticleFile.do?attachType=PDF&id=12062
12063,利用纳米碳与亚甲蓝示踪甲状腺乳头状癌前哨淋巴结的对比研究,"陈杰, 周晓红, 李真华, 葛家华, 何云, 张玉莲",2017,01,07,https://zhxbygxbzz.cma-cmc.com.cn//CN/article/downloadArticleFile.do?attachType=PDF&id=12063
12064,盐霉素与三氧化二砷对肾癌KCC853细胞生物学行为的影响,"周明澍, 王珊珊, 袁守军, 王毅",2017,01,07,https://zhxbygxbzz.cma-cmc.com.cn//CN/article/downloadArticleFile.do?attachType=PDF&id=12064
12065,干细胞对环孢素肾病大鼠肾组织转化生长因子β1的影响,"张勇, 张巍, 张剑平, 卓文利, 吴卫真, 谭建明",2017,01,07,https://zhxbygxbzz.cma-cmc.com.cn//CN/article/downloadArticleFile.do?attachType=PDF&id=12065
12066,槲皮素对骨髓间充质干细胞移植联合肾移植所诱导的免疫耐受的影响,"杨军, 陈花, 石韶华, 马永文, 王振兴, 武小桐",2017,01,07,https://zhxbygxbzz.cma-cmc.com.cn//CN/article/downloadArticleFile.do?attachType=PDF&id=12066
12067,人脐带间充质干细胞神经向分化与去分化基因表达谱分析,"焦扬, 赵洪波, 刘平, 付旭锋, 陈国栋, 罗晓曦, 桑雄波, 郑冰蓉",2017,01,07,https://zhxbygxbzz.cma-cmc.com.cn//CN/article/downloadArticleFile.do?attachType=PDF&id=12067
12068,重组人MG53蛋白对人脐带间充质干细胞氧化损伤的保护作用,"黄团结, 宋及时, 马珊珊, 程康, 邢衢, 李鹏, 刘腾飞, 杨波, 关方霞",2017,01,07,https://zhxbygxbzz.cma-cmc.com.cn//CN/article/downloadArticleFile.do?attachType=PDF&id=12068
12069,骨髓间充质干细胞上清液对肾移植术后切口愈合不良的疗效观察,"林琴, 徐艳, 林丽丽, 陈书尚, 杨顺良",2017,01,07,https://zhxbygxbzz.cma-cmc.com.cn//CN/article/downloadArticleFile.do?attachType=PDF&id=12069
12070,不同时间下超低温保存肝癌组织细胞RNA完整性的差异分析,"曹国强, 张峰, 陈雷鸣, 陈海, 李彪, 冯晓文, 李红春, 谢海洋, 周琳",2017,01,07,https://zhxbygxbzz.cma-cmc.com.cn//CN/article/downloadArticleFile.do?attachType=PDF&id=12070
12071,γδT细胞及其在肿瘤免疫治疗中的研究进展,"肖凌, 张钦, 陈虎, 张斌",2017,01,07,https://zhxbygxbzz.cma-cmc.com.cn//CN/article/downloadArticleFile.do?attachType=PDF&id=12071
12072,糖尿病细胞治疗的研究进展,"刘英, 江霞",2017,01,07,https://zhxbygxbzz.cma-cmc.com.cn//CN/article/downloadArticleFile.do?attachType=PDF&id=12072
12073,临床级脐带间充质细胞制备及鉴定方法研究,"袁艳鹏, 王淑艳, 唐玺和, 刘仲凤, 张愚, 陈志国",2017,02,07,https://zhxbygxbzz.cma-cmc.com.cn//CN/article/downloadArticleFile.do?attachType=PDF&id=12073
12074,脐带血单个核细胞对大鼠帕金森病的治疗效果观察,"陈超, 段婧, 申爱芳, 王伟, 宋昊, 芦现杰, 王晓兵, 韩忠朝, 韩发彬",2017,02,07,https://zhxbygxbzz.cma-cmc.com.cn//CN/article/downloadArticleFile.do?attachType=PDF&id=12074
12075,丁苯酞联合神经节苷脂对急性重度一氧化碳中毒患者乳酸清除率及免疫T细胞的影响分析,"李俊稷, 李晓萍",2017,02,07,https://zhxbygxbzz.cma-cmc.com.cn//CN/article/downloadArticleFile.do?attachType=PDF&id=12075
12076,两种人脐带间充质干细胞源外泌体分离方法的比较,"刘高米洋, 潘兴华, 和法莲, 陆容, 刘菊芬, 何洁, 王红阳",2017,02,07,https://zhxbygxbzz.cma-cmc.com.cn//CN/article/downloadArticleFile.do?attachType=PDF&id=12076
12077,人脐带间充质干细胞对小鼠实验性溃疡性结肠炎的疗效,"翟俊山, 李方, 孙亚梅, 宋久刚, 吴凯, 王艳梅, 张林, 姚怡, 李楠",2017,02,07,https://zhxbygxbzz.cma-cmc.com.cn//CN/article/downloadArticleFile.do?attachType=PDF&id=12077
12078,脐带间充质干细胞联合UM171对脐血源CD34+细胞的扩增效果研究,"李猛, 盛宏霞, 刘阳, 廖丽, 田宠, 孙鹏, 张斌, 陈虎",2017,02,07,https://zhxbygxbzz.cma-cmc.com.cn//CN/article/downloadArticleFile.do?attachType=PDF&id=12078
12079,LC3基因沉默对小鼠肝癌细胞Heap1-6凋亡影响的研究,"任冰霜, 雷艳, 孔旭辉, 王水良, 路君, 黄梁浒",2017,02,07,https://zhxbygxbzz.cma-cmc.com.cn//CN/article/downloadArticleFile.do?attachType=PDF&id=12079
12080,物理信号调控间充质干细胞行为的研究进展,"姚生莲, 王秀梅, 王鲁宁",2017,02,07,https://zhxbygxbzz.cma-cmc.com.cn//CN/article/downloadArticleFile.do?attachType=PDF&id=12080
12081,上皮干细胞参与肿瘤恶变的机制,"张诗惠, 胡琼, 谢富安, 洪笑迁, 刘宽灿",2017,02,07,https://zhxbygxbzz.cma-cmc.com.cn//CN/article/downloadArticleFile.do?attachType=PDF&id=12081
12082,毛囊源性黑色素细胞的生物学特性及其体外培养技术研究进展,"樊蕊蕊, 刘菲琳, 郝德顺, 张琪, 张莹瑶, 郑彤, 李士伦, 王鸿艳, 戚良晨, 刘晋宇",2017,02,07,https://zhxbygxbzz.cma-cmc.com.cn//CN/article/downloadArticleFile.do?attachType=PDF&id=12082
12083,间充质干细胞诱导分化为肺泡上皮细胞治疗急性呼吸窘迫综合征研究进展,"陈钦桂, 曾勉",2017,02,07,https://zhxbygxbzz.cma-cmc.com.cn//CN/article/downloadArticleFile.do?attachType=PDF&id=12083
12084,高剂量pSin慢病毒载体介导的转染对诱导性多能干细胞影响的研究,"黄乙涓, 黄强, 吕欧",2017,03,07,https://zhxbygxbzz.cma-cmc.com.cn//CN/article/downloadArticleFile.do?attachType=PDF&id=12084
12085,人脐带间充质干细胞对猕猴糖尿病治疗效果的研究,"阮光萍, 刘菊芬, 李自安, 王金祥, 庞荣清, 潘兴华",2017,03,07,https://zhxbygxbzz.cma-cmc.com.cn//CN/article/downloadArticleFile.do?attachType=PDF&id=12085
12086,自体干细胞对常规血运重建失败的重度肢体缺血患者的疗效观察,"方圆, 董智慧, 魏征, 符伟国, 潘天岳, 顾史洋, 陈斌, 郭大乔, 徐欣, 刘澎, 蒋俊豪, 杨珏",2017,03,07,https://zhxbygxbzz.cma-cmc.com.cn//CN/article/downloadArticleFile.do?attachType=PDF&id=12086
12087,利拉鲁肽对2型糖尿病合并低T3综合征患者糖化血红蛋白和胰岛β细胞功能及体脂的影响分析,马英丽,2017,03,07,https://zhxbygxbzz.cma-cmc.com.cn//CN/article/downloadArticleFile.do?attachType=PDF&id=12087
12088,免疫磁珠分离淋巴细胞在流式交叉配型试验中的应用及研究,"郭靖, 罗奇志, 田芳, 郭旭丽, 罗伟光, 邹义洲",2017,03,07,https://zhxbygxbzz.cma-cmc.com.cn//CN/article/downloadArticleFile.do?attachType=PDF&id=12088
12089,Indoxyl Sulfate诱导腹膜间皮细胞转分化的实验研究,"王强, 俞国庆, 黄雅清, 傅云泉, 陈鑫, 庄永泽",2017,03,07,https://zhxbygxbzz.cma-cmc.com.cn//CN/article/downloadArticleFile.do?attachType=PDF&id=12089
12090,外周静脉输注脐带间充质干细胞致血栓形成临床研究,"陈丰穗, 吴志贤, 蔡锦全, 高霞, 谭建明",2017,03,07,https://zhxbygxbzz.cma-cmc.com.cn//CN/article/downloadArticleFile.do?attachType=PDF&id=12090
12091,神经修复临床细胞治疗现状与展望,"黄红云, 毛更生, 陈琳",2017,03,07,https://zhxbygxbzz.cma-cmc.com.cn//CN/article/downloadArticleFile.do?attachType=PDF&id=12091
12092,淋巴细胞亚群成员研究进展,"马锡慧, 肖漓",2017,03,07,https://zhxbygxbzz.cma-cmc.com.cn//CN/article/downloadArticleFile.do?attachType=PDF&id=12092
12093,间充质干细胞治疗主动脉瘤的研究进展,"杨俊林, 曲乐丰",2017,03,07,https://zhxbygxbzz.cma-cmc.com.cn//CN/article/downloadArticleFile.do?attachType=PDF&id=12093
12094,间充质干细胞在软骨损伤修复中的研究进展,"卫旭东, 党源, 胡德庆",2017,03,07,https://zhxbygxbzz.cma-cmc.com.cn//CN/article/downloadArticleFile.do?attachType=PDF&id=12094
12095,干细胞向甲状腺滤泡细胞的分化研究,"盛建国, 张传森, 章建全",2017,03,07,https://zhxbygxbzz.cma-cmc.com.cn//CN/article/downloadArticleFile.do?attachType=PDF&id=12095
12096,新型慢病毒转染四种细胞及在体内示踪的研究,"刘菊芬, 阮光萍, 李自安, 王金祥, 庞荣清, 潘兴华",2017,04,07,https://zhxbygxbzz.cma-cmc.com.cn//CN/article/downloadArticleFile.do?attachType=PDF&id=12096
12097,利用析因设计法优化神经干细胞分化为多巴胺能神经元的诱导方案,"宋振涛, 陈恒, 王帅, 田振辉, 刘小盾, 曲廷瑜",2017,04,07,https://zhxbygxbzz.cma-cmc.com.cn//CN/article/downloadArticleFile.do?attachType=PDF&id=12097
12098,心肌样细胞移植对大鼠心肌梗死的疗效观察,"王秀力, 姜世强, 刘颖, 王洁, 吕茜, 王雷, 李春梅, 宫海滨",2017,04,07,https://zhxbygxbzz.cma-cmc.com.cn//CN/article/downloadArticleFile.do?attachType=PDF&id=12098
12099,骨髓间充质干细胞对大鼠血管性痴呆模型GAT1的调节作用研究,"龙乾发, 罗强, 田晔, 刘卫平, 黑悦",2017,04,07,https://zhxbygxbzz.cma-cmc.com.cn//CN/article/downloadArticleFile.do?attachType=PDF&id=12099
12100,SHP-2激活突变对人脑胶质瘤细胞凋亡及增殖影响的研究,"江伟, 王鹏, 左威, 程超, 曾文, 张亮, 李维新",2017,04,07,https://zhxbygxbzz.cma-cmc.com.cn//CN/article/downloadArticleFile.do?attachType=PDF&id=12100
12101,补骨脂素对前列腺癌LNCap-AD细胞增殖的影响及其分子机制研究,"陈书尚, 翁铭芳, 王水良, 路君, 谭建明",2017,04,07,https://zhxbygxbzz.cma-cmc.com.cn//CN/article/downloadArticleFile.do?attachType=PDF&id=12101
12102,人脐带间充质干细胞来源的外泌体减轻肝脏缺血再灌注损伤及机制的初步研究,"冯啸, 陈良, 张琪, 杨扬, 陈规划, 张英才",2017,04,07,https://zhxbygxbzz.cma-cmc.com.cn//CN/article/downloadArticleFile.do?attachType=PDF&id=12102
12103,间充质干细胞的恶性转化研究进展,"刘聪, 张墨, Hong-Long Ji",2017,04,07,https://zhxbygxbzz.cma-cmc.com.cn//CN/article/downloadArticleFile.do?attachType=PDF&id=12103
12104,巨噬细胞在动脉粥样硬化发病机制中作用的研究进展,"李伟, 朱莉, 阮中宝, 任寅",2017,04,07,https://zhxbygxbzz.cma-cmc.com.cn//CN/article/downloadArticleFile.do?attachType=PDF&id=12104
12105,间充质干细胞衰老机制的研究进展,"刘洋, 冯新民, 陈涛, 黄泽楠, 张亮",2017,04,07,https://zhxbygxbzz.cma-cmc.com.cn//CN/article/downloadArticleFile.do?attachType=PDF&id=12105
12106,间充质（干）细胞的定义变迁,陈津,2017,04,07,https://zhxbygxbzz.cma-cmc.com.cn//CN/article/downloadArticleFile.do?attachType=PDF&id=12106
12107,间充质干细胞更改名称的时候到了,Arnold I. Caplan,2017,05,07,https://zhxbygxbzz.cma-cmc.com.cn//CN/article/downloadArticleFile.do?attachType=PDF&id=12107
12108,Epha4基因通过FGF信号通路调节大脑皮层发育,"陈清法, 韩发彬",2017,05,07,https://zhxbygxbzz.cma-cmc.com.cn//CN/article/downloadArticleFile.do?attachType=PDF&id=12108
12109,基质交联分子1表达下调对人胰腺癌SW1990细胞周期及细胞凋亡的影响,"黎美琳, 顾鹏",2017,05,07,https://zhxbygxbzz.cma-cmc.com.cn//CN/article/downloadArticleFile.do?attachType=PDF&id=12109
12110,碱性成纤维生长因子转染骨髓间充质干细胞移植对心肌病心力衰竭大鼠心功能的影响,"赖增华, 窦学凯, 贾春文, 姜朝晖",2017,05,07,https://zhxbygxbzz.cma-cmc.com.cn//CN/article/downloadArticleFile.do?attachType=PDF&id=12110
12111,不同注射途径的脂肪间充质干细胞对大鼠肠炎疗效的实验研究,"付正伟, 张振宇, 葛海燕",2017,05,07,https://zhxbygxbzz.cma-cmc.com.cn//CN/article/downloadArticleFile.do?attachType=PDF&id=12111
12112,脑脊液中CD4+CD25+Treg、sICAM-1及BAFF与动脉瘤蛛网膜下腔出血的相关性研究,"李淑雯, 吕亮亮",2017,05,07,https://zhxbygxbzz.cma-cmc.com.cn//CN/article/downloadArticleFile.do?attachType=PDF&id=12112
12113,CD68、CD133和TGF-β在肝癌及癌旁组织中的表达及其在临床转归中的意义,"宋晨鑫, 丛明华, 邹宝华, 于雷",2017,05,07,https://zhxbygxbzz.cma-cmc.com.cn//CN/article/downloadArticleFile.do?attachType=PDF&id=12113
12114,从文献计量学角度探讨脂肪间充质干细胞的发展历程,"黄永增, 蔡晓珍, 朱东屏, 陈媛媛, 李少婷, 陈贞春",2017,05,07,https://zhxbygxbzz.cma-cmc.com.cn//CN/article/downloadArticleFile.do?attachType=PDF&id=12114
12115,脐带血非造血性功能定向干（祖）细胞研究进展,"徐峰波, 崔光晶, 曹光鑫",2017,05,07,https://zhxbygxbzz.cma-cmc.com.cn//CN/article/downloadArticleFile.do?attachType=PDF&id=12115
12116,干细胞对糖尿病足的治疗研究进展,"高弘烨, 黄平平",2017,05,07,https://zhxbygxbzz.cma-cmc.com.cn//CN/article/downloadArticleFile.do?attachType=PDF&id=12116
12117,羊膜间充质干细胞的免疫调节功能研究进展,"欧阳文, 廖正权, 夏增飞, 高雅, 郭燕舞, 孙海涛",2017,05,07,https://zhxbygxbzz.cma-cmc.com.cn//CN/article/downloadArticleFile.do?attachType=PDF&id=12117
12118,脐血干细胞移植对失代偿期肝硬化患者TNF-α浓度和CD45RO+粒细胞表达的影响,"董媛, 师贞宗",2017,06,07,https://zhxbygxbzz.cma-cmc.com.cn//CN/article/downloadArticleFile.do?attachType=PDF&id=12118
12119,TGF-β、GFAP及免疫细胞的表达对恶性胶质瘤术后同期推量调强放疗患者生存情况的影响,苏优勒,2017,06,07,https://zhxbygxbzz.cma-cmc.com.cn//CN/article/downloadArticleFile.do?attachType=PDF&id=12119
12120,齐墩果酸通过PPARγ调控人脐静脉内皮细胞抗氧化损伤作用,"朱宝华, 谷春景, 刘凤莲, 刘璐, 任艳红",2017,06,07,https://zhxbygxbzz.cma-cmc.com.cn//CN/article/downloadArticleFile.do?attachType=PDF&id=12120
12121,干细胞标志物CD133、CD44v6、PSCA和Oct-4在胃癌组织中表达及其临床意义,曾春兰,2017,06,07,https://zhxbygxbzz.cma-cmc.com.cn//CN/article/downloadArticleFile.do?attachType=PDF&id=12121
12122,脐血单个核细胞对缺血性脑卒中的临床干预,"满勇, 王飞, 马冀, 周璐, 李青, 丁金萍, 王晓鸣, 李锦山, 李新民, 姬汴生, 李建斌, 单泓, 张大焕, 李金花",2017,06,07,https://zhxbygxbzz.cma-cmc.com.cn//CN/article/downloadArticleFile.do?attachType=PDF&id=12122
12123,抑制NANOG表达对人食管鳞癌Eca-109干细胞增殖的影响,"邓丽, 向小聪, 张若兰, 刘康, 冯刚",2017,06,07,https://zhxbygxbzz.cma-cmc.com.cn//CN/article/downloadArticleFile.do?attachType=PDF&id=12123
12124,细胞膜片技术在组织工程中的应用,"郭海林, 贾智明, 鲍星奇, 谢华, 陈方",2017,06,07,https://zhxbygxbzz.cma-cmc.com.cn//CN/article/downloadArticleFile.do?attachType=PDF&id=12124
12125,诱导多能干细胞向角膜上皮细胞分化的研究进展,"熊蓉, 李战梅, 冯刚",2017,06,07,https://zhxbygxbzz.cma-cmc.com.cn//CN/article/downloadArticleFile.do?attachType=PDF&id=12125
12126,自噬对间充质干细胞的生物学作用研究进展,"王泽宇, 张亮, 陈涛, 黄泽楠, 冯新民",2017,06,07,https://zhxbygxbzz.cma-cmc.com.cn//CN/article/downloadArticleFile.do?attachType=PDF&id=12126
12127,毛囊干细胞在皮肤创伤修复中的促进作用,"裴卓, 周聪, 张一鸣, 李玉红",2017,06,07,https://zhxbygxbzz.cma-cmc.com.cn//CN/article/downloadArticleFile.do?attachType=PDF&id=12127
12128,干细胞对皮肤瘢痕的治疗作用,"张文博, 孙善全",2017,06,07,https://zhxbygxbzz.cma-cmc.com.cn//CN/article/downloadArticleFile.do?attachType=PDF&id=12128
12129,间充质干细胞调节炎症反应的研究进展,孔旭辉,2017,06,07,https://zhxbygxbzz.cma-cmc.com.cn//CN/article/downloadArticleFile.do?attachType=PDF&id=12129
12130,补骨脂素对前列腺癌LNCaP-AI细胞增殖和周期调控及雌激素受体β表达的影响,"李少鹏, 蔡建通, 翁铭芳, 游翰林, 陈书尚, 吴卫真",2018,01,08,https://zhxbygxbzz.cma-cmc.com.cn//CN/article/downloadArticleFile.do?attachType=PDF&id=12130
12131,人脐带间充质干细胞在Balb/c裸鼠体内的分布情况研究,"谢长峰, 马炜, 彭浩, 杨晓菲, 曾桂芳, 刘云城, 刘沐芸, 胡祥",2018,01,08,https://zhxbygxbzz.cma-cmc.com.cn//CN/article/downloadArticleFile.do?attachType=PDF&id=12131
12132,丁苯酞对七氟醚诱导神经细胞损伤的保护作用,鲁瑞涛,2018,01,08,https://zhxbygxbzz.cma-cmc.com.cn//CN/article/downloadArticleFile.do?attachType=PDF&id=12132
12133,ALDH1蛋白表达与胶质瘤干细胞体外分化相关性的研究,"王鹏, 宋伟正, 毛庆, 陈米娜, 刘艳辉",2018,01,08,https://zhxbygxbzz.cma-cmc.com.cn//CN/article/downloadArticleFile.do?attachType=PDF&id=12133
12134,神经祖细胞与纤维蛋白支撑物移植对老年痴呆模型鼠的记忆认知功能改善及其机理探究,"刘延明, 王伟, 魏传飞, 陈清法, 韩发彬",2018,01,08,https://zhxbygxbzz.cma-cmc.com.cn//CN/article/downloadArticleFile.do?attachType=PDF&id=12134
12135,自体骨髓间充质干细胞对二甲基甲酰胺中毒肝衰竭患者肝功能恢复的促进作用,"吴海聪, 李东良, 方坚, 张志强, 夏磊, 刘邦",2018,01,08,https://zhxbygxbzz.cma-cmc.com.cn//CN/article/downloadArticleFile.do?attachType=PDF&id=12135
12136,肿瘤相关间充质干细胞及其靶向治疗的研究进展,"王萍, 马予洁, 路君, 王庆华, 谭建明",2018,01,08,https://zhxbygxbzz.cma-cmc.com.cn//CN/article/downloadArticleFile.do?attachType=PDF&id=12136
12137,间充质干细胞在恶性肿瘤生物学中作用的研究进展,"林婷婷, 任群",2018,01,08,https://zhxbygxbzz.cma-cmc.com.cn//CN/article/downloadArticleFile.do?attachType=PDF&id=12137
12138,多能干细胞诱导分化为肾脏类器官的分子机制及应用前景分析,"张登禄, 杜枭航, 孔峰, 赵升田",2018,01,08,https://zhxbygxbzz.cma-cmc.com.cn//CN/article/downloadArticleFile.do?attachType=PDF&id=12138
12139,母体外周血中胎儿有核红细胞的分离和富集方法的研究进展,"梁卉, 陈国杰, 于燕, 熊礼宽",2018,01,08,https://zhxbygxbzz.cma-cmc.com.cn//CN/article/downloadArticleFile.do?attachType=PDF&id=12139
12140,骨髓间充质干细胞向肝细胞分化的相关细胞因子及信号通路的研究进展,"陈嘉成, 傅念, 黄幼姣, 全宏军",2018,01,08,https://zhxbygxbzz.cma-cmc.com.cn//CN/article/downloadArticleFile.do?attachType=PDF&id=12140
12141,TLRs信号通路激活的MSCs外泌体对巨噬细胞极化的影响,"冉凤英, 陈龙, 张斌强, 尚兵, 余飞, 陈炜, 陈琴华",2018,02,08,https://zhxbygxbzz.cma-cmc.com.cn//CN/article/downloadArticleFile.do?attachType=PDF&id=12141
12142,支架材料对棕色脂肪源性干细胞向起搏细胞诱导分化的影响,"姬瑞娟, 乔梁, 黄超, 陈磊, 李玉泉, 杨向群",2018,02,08,https://zhxbygxbzz.cma-cmc.com.cn//CN/article/downloadArticleFile.do?attachType=PDF&id=12142
12143,肾透明细胞癌Caki-1细胞系差异表达基因的生物信息学分析,"朱合欢, 赵虎, 林智文, 王洁, 路君, 谭建明",2018,02,08,https://zhxbygxbzz.cma-cmc.com.cn//CN/article/downloadArticleFile.do?attachType=PDF&id=12143
12144,高表达microRNA-155的骨髓间充质干细胞对免疫调节的影响,"谢林岑, 陈月秋, 沈振亚",2018,02,08,https://zhxbygxbzz.cma-cmc.com.cn//CN/article/downloadArticleFile.do?attachType=PDF&id=12144
12145,定向激活HIF-1协同脂肪干细胞对糖尿病小鼠皮肤创伤修复的促进作用,"杜俊凯, 陈明月, 徐之超, 白立曦, 段鹏",2018,02,08,https://zhxbygxbzz.cma-cmc.com.cn//CN/article/downloadArticleFile.do?attachType=PDF&id=12145
12146,PLAC1特异性TCR基因修饰T细胞对乳腺癌的抗肿瘤作用,"李琼书, 成先义, 胡源, 陈洁莹, 巩秀, 肖东, 胡祥, 刘未斌",2018,02,08,https://zhxbygxbzz.cma-cmc.com.cn//CN/article/downloadArticleFile.do?attachType=PDF&id=12146
12147,单倍体相合造血干细胞移植联合脐带间充质干细胞输注治疗儿童重型再生障碍性贫血的临床观察及安全性分析,"井远方, 卢伟, 唐湘凤",2018,02,08,https://zhxbygxbzz.cma-cmc.com.cn//CN/article/downloadArticleFile.do?attachType=PDF&id=12147
12148,经寰枕间隙侧方穿刺移植人脐血单个核细胞对难治性神经系统疾病的疗效分析,"于海燕, 宫殿荣, 袁晓玲, 刘力峰, 赵敏, 王敏, 芦倩",2018,02,08,https://zhxbygxbzz.cma-cmc.com.cn//CN/article/downloadArticleFile.do?attachType=PDF&id=12148
12149,间充质干细胞治疗急性放射性损伤的研究,"薛飞, 黄平平",2018,02,08,https://zhxbygxbzz.cma-cmc.com.cn//CN/article/downloadArticleFile.do?attachType=PDF&id=12149
12150,干细胞产业发展探索：浅谈上海市东方医院在干细胞转化领域的实践,"何斌, 郑天慧, 赵庆辉, 汤红明",2018,02,08,https://zhxbygxbzz.cma-cmc.com.cn//CN/article/downloadArticleFile.do?attachType=PDF&id=12150
12151,槲皮素对人脑胶质瘤干细胞生物学行为及miR-29s家族的影响分析,"王冬芮, 张永慈, 王增光",2018,03,08,https://zhxbygxbzz.cma-cmc.com.cn//CN/article/downloadArticleFile.do?attachType=PDF&id=12151
12152,高糖通过诱导自噬障碍促进心肌细胞H9c2凋亡,"方媛, 郭统帅, 吴岳, 刘洋, 曹瑜梦, 雷新军",2018,03,08,https://zhxbygxbzz.cma-cmc.com.cn//CN/article/downloadArticleFile.do?attachType=PDF&id=12152
12153,IL-12重组质粒联合骨髓间充质干细胞对MCF-7人乳腺癌细胞侵袭及裸鼠移植瘤生长的影响分析,"张睿, 崔乐",2018,03,08,https://zhxbygxbzz.cma-cmc.com.cn//CN/article/downloadArticleFile.do?attachType=PDF&id=12153
12154,肾透明细胞癌预后相关miRNAs的生物信息学分析,"付军明, 肖招兰, 何富强, 郭君其, 谭建明, 朱凌峰",2018,03,08,https://zhxbygxbzz.cma-cmc.com.cn//CN/article/downloadArticleFile.do?attachType=PDF&id=12154
12155,缺血性脑梗死与颈动脉斑块、嗜酸性粒细胞、血小板CD62p水平的临床相关性研究,"郭立斌, 施宛辰, 刘英",2018,03,08,https://zhxbygxbzz.cma-cmc.com.cn//CN/article/downloadArticleFile.do?attachType=PDF&id=12155
12156,AngⅡ通过激活Notch1/Sox2通路对肝星状细胞LX2的活化和增殖的作用,"郑伟, 常虎林, 海军, 宋晓雪, 杜立学",2018,03,08,https://zhxbygxbzz.cma-cmc.com.cn//CN/article/downloadArticleFile.do?attachType=PDF&id=12156
12157,大鼠骨骼肌卫星细胞诱导分化为胰岛素生成细胞的研究,"任宇, 梁红宇, 楠吉桑漠, 刘晓玲",2018,03,08,https://zhxbygxbzz.cma-cmc.com.cn//CN/article/downloadArticleFile.do?attachType=PDF&id=12157
12158,干细胞向甲状旁腺细胞的分化及在甲状旁腺功能减退中的研究进展,"李佳丽, 赵瑞力",2018,03,08,https://zhxbygxbzz.cma-cmc.com.cn//CN/article/downloadArticleFile.do?attachType=PDF&id=12158
12159,磷脂酶D1信号对神经干细胞向神经分化的重要影响,"张金梅, 杨远荣",2018,03,08,https://zhxbygxbzz.cma-cmc.com.cn//CN/article/downloadArticleFile.do?attachType=PDF&id=12159
12160,线粒体代谢与干细胞的命运决定,"马明慧, 马悦佼, 孙婕, 张海燕",2018,03,08,https://zhxbygxbzz.cma-cmc.com.cn//CN/article/downloadArticleFile.do?attachType=PDF&id=12160
12161,极小胚胎样干细胞研究进展,"徐峰波, 崔光晶, 刘倩, 王肇光, 曹启龙",2018,03,08,https://zhxbygxbzz.cma-cmc.com.cn//CN/article/downloadArticleFile.do?attachType=PDF&id=12161
12162,骨髓间充质干细胞成肌分化在骨骼肌再生中的应用,"李鹏, 郭修田",2018,03,08,https://zhxbygxbzz.cma-cmc.com.cn//CN/article/downloadArticleFile.do?attachType=PDF&id=12162
12163,miR-34a-5p靶向GMFB抑制细胞增殖对先天性巨结肠的治疗意义,"张亚飞, 余辉, 郑百俊, 谢崇, 葛鑫, 李鹏, 高亚, 潘伟康",2018,04,08,https://zhxbygxbzz.cma-cmc.com.cn//CN/article/downloadArticleFile.do?attachType=PDF&id=12163
12164,骨髓间充质干细胞对肾移植受者T淋巴细胞分化和miRNA-155表达的影响,"朱凌峰, 陈书尚, 蔡锦全, 谭建明, 翁明芳",2018,04,08,https://zhxbygxbzz.cma-cmc.com.cn//CN/article/downloadArticleFile.do?attachType=PDF&id=12164
12165,巨噬细胞浸润在低级别胶质瘤预后预测中的研究,"马健行, 吴鹏飞, 杨伟, 廖茂君, 易良, 许民辉",2018,04,08,https://zhxbygxbzz.cma-cmc.com.cn//CN/article/downloadArticleFile.do?attachType=PDF&id=12165
12166,间充质细胞外泌体促进小鼠胰岛内皮细胞血管生成的研究,"陈俊秋, 陈津, 黄梁浒, 赵红州, 付云烽, 林娜, 朱凌峰, 程远航, 王水良, 谭建明",2018,04,08,https://zhxbygxbzz.cma-cmc.com.cn//CN/article/downloadArticleFile.do?attachType=PDF&id=12166
12167,硫化氢通过调控SIRT1抑制阿霉素诱导的H9c2细胞损伤,"哈斯高娃, 曹中朝, 刘东华",2018,04,08,https://zhxbygxbzz.cma-cmc.com.cn//CN/article/downloadArticleFile.do?attachType=PDF&id=12167
12168,影响脐带血采集质量的相关性因素分析,"张晋, 袁哲",2018,04,08,https://zhxbygxbzz.cma-cmc.com.cn//CN/article/downloadArticleFile.do?attachType=PDF&id=12168
12169,人脐带间充质干细胞移植治疗脊髓损伤的研究进展,"陈奇, 孙翊夫, 吕晓霞, 张福强, 顾锐, 高旭, 邵立伟, 姜金兰",2018,04,08,https://zhxbygxbzz.cma-cmc.com.cn//CN/article/downloadArticleFile.do?attachType=PDF&id=12169
12170,多能干细胞向雄性生殖细胞定向分化的研究进展,"王新杰, 姬小利, 王敏, 周君梅",2018,04,08,https://zhxbygxbzz.cma-cmc.com.cn//CN/article/downloadArticleFile.do?attachType=PDF&id=12170
12171,间充质干细胞旁分泌作用的研究进展,"刘湄漪, 陈乃耀",2018,04,08,https://zhxbygxbzz.cma-cmc.com.cn//CN/article/downloadArticleFile.do?attachType=PDF&id=12171
12172,间充质干细胞治疗糖尿病皮肤损伤的研究进展,"张涛, 惠定一, 王颜刚",2018,04,08,https://zhxbygxbzz.cma-cmc.com.cn//CN/article/downloadArticleFile.do?attachType=PDF&id=12172
12173,凋亡细胞的清除及组织稳态维持的研究进展,"叶庆元, 刘世宇, 金岩",2018,04,08,https://zhxbygxbzz.cma-cmc.com.cn//CN/article/downloadArticleFile.do?attachType=PDF&id=12173
12174,抑癌基因PTEN及其假基因PTENP1在子宫内膜癌中的研究进展,丁智颖,2018,04,08,https://zhxbygxbzz.cma-cmc.com.cn//CN/article/downloadArticleFile.do?attachType=PDF&id=12174
