article_id,title,author,year,issue,volume,pdf_url
31730,无缝手术护理在腹股沟疝腹腔镜手术围手术期的应用效果,"戴玮, 江桂林, 车兆平, 张姣, 王星星, 赵海涛",2023,06,17,https://zhshfbwkzz.cma-cmc.com.cn//CN/article/downloadArticleFile.do?attachType=PDF&id=31730
31731,循证医学理念在儿童腹股沟疝患者中的应用,"李芳, 许瑞, 李洋洋, 石秀全",2023,06,17,https://zhshfbwkzz.cma-cmc.com.cn//CN/article/downloadArticleFile.do?attachType=PDF&id=31731
32403,从文献计量学分析看我国疝和腹壁外科的发展,"嵇振岭, 陈杰, 唐健雄",2024,01,18,https://zhshfbwkzz.cma-cmc.com.cn//CN/article/downloadArticleFile.do?attachType=PDF&id=32403
32404,复杂腹壁疝微共识：嵌顿、绞窄性腹壁疝,"《复杂腹壁疝微共识：嵌顿、绞窄性腹壁疝》编审委员会, 《中华疝和腹壁外科杂志（电子版）》编辑委员会, 全国卫生产业企业管理协会疝和腹壁外科产业及临床研究分会复杂腹壁疝及减重专家组",2024,01,18,https://zhshfbwkzz.cma-cmc.com.cn//CN/article/downloadArticleFile.do?attachType=PDF&id=32404
32405,复杂腹壁疝微共识：腹壁疝合并脏器外露,"《复杂腹壁疝微共识：腹壁疝合并脏器外露》编审委员会, 《中华疝和腹壁外科杂志（电子版）》编辑委员会, 全国卫生产业企业管理协会疝和腹壁外科产业及临床研究分会复杂腹壁疝及减重专家组",2024,01,18,https://zhshfbwkzz.cma-cmc.com.cn//CN/article/downloadArticleFile.do?attachType=PDF&id=32405
32406,复发性腹壁切口疝的研究进展,"赵家劲, 谢肖俊",2024,01,18,https://zhshfbwkzz.cma-cmc.com.cn//CN/article/downloadArticleFile.do?attachType=PDF&id=32406
32407,成人腹股沟疝日间手术麻醉管理,"张良燕, 曹桢, 刘子嘉",2024,01,18,https://zhshfbwkzz.cma-cmc.com.cn//CN/article/downloadArticleFile.do?attachType=PDF&id=32407
32408,成人腹股沟疝日间手术患者住院费用影响因素分析,"佟得语, 刘小莉, 马秋月, 申英末",2024,01,18,https://zhshfbwkzz.cma-cmc.com.cn//CN/article/downloadArticleFile.do?attachType=PDF&id=32408
32409,日归手术管理模式下疝修补术的加速康复实践分析,"孙义元, 马洪升, 雷文章, 宋应寒",2024,01,18,https://zhshfbwkzz.cma-cmc.com.cn//CN/article/downloadArticleFile.do?attachType=PDF&id=32409
32410,加速康复外科理念和腹股沟疝日间手术模式在基层医院的临床应用,"罗威, 申英末, 孙立",2024,01,18,https://zhshfbwkzz.cma-cmc.com.cn//CN/article/downloadArticleFile.do?attachType=PDF&id=32410
32411,腹腔镜全腹膜外腹股沟疝修补术日间手术模式临床应用研究,"钟春林, 罗丹, 于颖娟, 杨可, 周燕, 张梅, 刘文",2024,01,18,https://zhshfbwkzz.cma-cmc.com.cn//CN/article/downloadArticleFile.do?attachType=PDF&id=32411
32412,成人腹股沟疝日间手术单中心诊疗经验及分析,"罗文, 王勇, 段鑫, 石念, 柯文杰, 武英翔, 杜晨阳, 雷啸天",2024,01,18,https://zhshfbwkzz.cma-cmc.com.cn//CN/article/downloadArticleFile.do?attachType=PDF&id=32412
32413,腹股沟疝日间手术腹腔镜全腹膜外疝修补术与Lichtenstein术对照研究,"徐妙军, 唐黎明, 孙一峰",2024,01,18,https://zhshfbwkzz.cma-cmc.com.cn//CN/article/downloadArticleFile.do?attachType=PDF&id=32413
32414,全程护理管理模式对腹股沟疝日间手术患者出院准备度的干预效果评价,"黄静, 商玉环",2024,01,18,https://zhshfbwkzz.cma-cmc.com.cn//CN/article/downloadArticleFile.do?attachType=PDF&id=32414
32415,日间疝修补术后不同加压方式对血清肿预防的差异研究,"张翔, 林凯, 潘勇, 杨春",2024,01,18,https://zhshfbwkzz.cma-cmc.com.cn//CN/article/downloadArticleFile.do?attachType=PDF&id=32415
32416,腹膜前间隙补片修补对切口疝大鼠碱性成纤维生长因子（bFGF）的影响,"贵诗雨, 方向, 黄丹, 朱佳琳, 周小雨, 郭文恺",2024,01,18,https://zhshfbwkzz.cma-cmc.com.cn//CN/article/downloadArticleFile.do?attachType=PDF&id=32416
32417,基于影像学指标构建永久性乙状结肠造口旁疝发病风险预测模型,"刘化胜, 郑龙波, 秦琛, 王伟芹, 郑学风, 马金龙, 马正, 王洪霞, 刘磊, 胡继霖",2024,01,18,https://zhshfbwkzz.cma-cmc.com.cn//CN/article/downloadArticleFile.do?attachType=PDF&id=32417
32418,腹壁切口疝围手术期并发症发生危险因素分析,"师帅, 马文星, 陈昕, 单良, 王泽正, 段降龙, 吴云桦",2024,01,18,https://zhshfbwkzz.cma-cmc.com.cn//CN/article/downloadArticleFile.do?attachType=PDF&id=32418
32419,高分辨率食管测压在胃食管反流病食管运动功能评价中的应用,"梁艳, 胡志伟, 刘健男, 宋庆, 陈冬, 田书瑞, 李冉, 毛建新",2024,01,18,https://zhshfbwkzz.cma-cmc.com.cn//CN/article/downloadArticleFile.do?attachType=PDF&id=32419
32420,腹腔镜下基于疝环缝合的生物补片经腹腹膜前修补术治疗成人腹股沟疝疗效分析,"李宝山, 王荫龙, 张新, 胡巍, 满艺",2024,01,18,https://zhshfbwkzz.cma-cmc.com.cn//CN/article/downloadArticleFile.do?attachType=PDF&id=32420
32421,MiniLap辅助两穿刺孔腹腔镜全腹膜外腹股沟疝修补术10例分析,"吴恺明, 郝腾飞, 张庆元",2024,01,18,https://zhshfbwkzz.cma-cmc.com.cn//CN/article/downloadArticleFile.do?attachType=PDF&id=32421
32422,腹腔镜辅助腹横肌平面阻滞在腹股沟疝修补术后镇痛中的应用,"马自达, 孟岩, 郭宏坤, 孙少川, 孙中伟",2024,01,18,https://zhshfbwkzz.cma-cmc.com.cn//CN/article/downloadArticleFile.do?attachType=PDF&id=32422
32423,高频超声联合多普勒超声诊断腹外疝的临床价值,"刘国安, 陈一杰, 赖江琼, 余丽平, 康春梅",2024,01,18,https://zhshfbwkzz.cma-cmc.com.cn//CN/article/downloadArticleFile.do?attachType=PDF&id=32423
32424,手术室全程积极保温在老年腹股沟疝手术中的应用,"孙丹丹, 叶红莎, 田雅静",2024,01,18,https://zhshfbwkzz.cma-cmc.com.cn//CN/article/downloadArticleFile.do?attachType=PDF&id=32424
32425,综合性优质护理对老年腹股沟疝患者干预效果分析,"王毅香, 尹芳芳, 燕燕",2024,01,18,https://zhshfbwkzz.cma-cmc.com.cn//CN/article/downloadArticleFile.do?attachType=PDF&id=32425
33112,对再生型疝修补补片动物试验设计的考量,"程茂波, 刘钰莎, 张旭, 刘文博, 赵鹏",2024,02,18,https://zhshfbwkzz.cma-cmc.com.cn//CN/article/downloadArticleFile.do?attachType=PDF&id=33112
33113,双面不对称补片在腹壁组织缺损修复中的应用,"欧阳阳, 于洋, 熊闻轩, 王辉, 黄榕康",2024,02,18,https://zhshfbwkzz.cma-cmc.com.cn//CN/article/downloadArticleFile.do?attachType=PDF&id=33113
33114,复合基底膜生物补片应用于腹股沟疝Lichtenstein修补术的随机、对照、多中心临床研究,"李绍杰, 谢奇峰, 李绍春, 杨子昂, 黄永刚, 陈吉彩, 杜舟, 王平, 张剑, 唐健雄",2024,02,18,https://zhshfbwkzz.cma-cmc.com.cn//CN/article/downloadArticleFile.do?attachType=PDF&id=33114
33115,基底膜生物补片用于腹腔内修补大鼠腹壁缺损手术引导组织再生的研究,"仲卫冬, 仲洁, 代京, 程文悦, 张剑",2024,02,18,https://zhshfbwkzz.cma-cmc.com.cn//CN/article/downloadArticleFile.do?attachType=PDF&id=33115
33116,体外和比格犬体内评价腹内压致生物补片分层及疝复发风险的研究,"王虞鹭, 代京, 程文悦, 徐隽雅, 张剑",2024,02,18,https://zhshfbwkzz.cma-cmc.com.cn//CN/article/downloadArticleFile.do?attachType=PDF&id=33116
33117,不同材料疝补片对大鼠腹壁缺损修补术后行为学影响的实验研究,"袁雪涛, 王星傑, 黑赫, 田泓漪, 刘俊矣, 魏光兵, 李徐奇, 蒋正东",2024,02,18,https://zhshfbwkzz.cma-cmc.com.cn//CN/article/downloadArticleFile.do?attachType=PDF&id=33117
33118,不同材质补片修补对腹壁疝大鼠腹横筋膜组织转化生长因子-β1及Collagen合成代谢的作用,"赛甫丁·艾比布拉, 买买提·依斯热依力, 李义亮, 王永康, 王志, 克力木·阿不都热依木",2024,02,18,https://zhshfbwkzz.cma-cmc.com.cn//CN/article/downloadArticleFile.do?attachType=PDF&id=33118
33119,模拟临床的猪腹壁切口疝模型建立研究,"仲洁, 逯景辉, 林振华, 程文悦, 代京, 张剑, 刘成虎",2024,02,18,https://zhshfbwkzz.cma-cmc.com.cn//CN/article/downloadArticleFile.do?attachType=PDF&id=33119
33120,医用胶在腹股沟疝中的临床研究进展,"曹桢, 刘子文",2024,02,18,https://zhshfbwkzz.cma-cmc.com.cn//CN/article/downloadArticleFile.do?attachType=PDF&id=33120
33121,腹壁巨大切口疝修补术后早期疼痛的危险因素分析,"陈传勤, 张凯, 单世涵, 陶亮, 傅巧美",2024,02,18,https://zhshfbwkzz.cma-cmc.com.cn//CN/article/downloadArticleFile.do?attachType=PDF&id=33121
33122,耻脐入路单孔腹腔镜后鞘后技术在脐疝修补术中的应用,"陈志升, 司仙科, 吴卫东, 李森, 杨佳华, 李炜, 郑侃, 于昆, 罗晓睿, 葛卫红",2024,02,18,https://zhshfbwkzz.cma-cmc.com.cn//CN/article/downloadArticleFile.do?attachType=PDF&id=33122
33123,腹腔镜手术方式在嵌顿性腹壁疝中的应用,宋延冰,2024,02,18,https://zhshfbwkzz.cma-cmc.com.cn//CN/article/downloadArticleFile.do?attachType=PDF&id=33123
33124,改良套扎法在腹腔镜完全腹膜外疝修补术中关闭腹膜破裂的临床应用,"李海风, 战俊, 滕世岗, 尹鹏, 刘忠诚",2024,02,18,https://zhshfbwkzz.cma-cmc.com.cn//CN/article/downloadArticleFile.do?attachType=PDF&id=33124
33125,腹腔镜下关闭Ⅲ型腹股沟斜疝内环联合补片修补的临床疗效,"罗彬予, 张肖, 郭庆, 喻晶, 张大权, 李权林, 周冬兵, 田云鸿, 任明扬",2024,02,18,https://zhshfbwkzz.cma-cmc.com.cn//CN/article/downloadArticleFile.do?attachType=PDF&id=33125
33126,35例闭孔疝患者临床诊断和治疗分析,"焦盛宇, 雷庆军, 周圣赢, 王兵, 孔智渊, 张剑, 徐小慧",2024,02,18,https://zhshfbwkzz.cma-cmc.com.cn//CN/article/downloadArticleFile.do?attachType=PDF&id=33126
33127,完全腔镜下腹直肌后修补术治疗产后腹直肌分离经验分享,"李斌, 康欣, 宋应寒, 雷文章",2024,02,18,https://zhshfbwkzz.cma-cmc.com.cn//CN/article/downloadArticleFile.do?attachType=PDF&id=33127
33128,日间手术模式下开展腹股沟疝手术的临床效果,"杜晨阳, 王勇, 段鑫, 柯文杰, 石念, 武英翔, 罗文",2024,02,18,https://zhshfbwkzz.cma-cmc.com.cn//CN/article/downloadArticleFile.do?attachType=PDF&id=33128
33129,羟考酮复合舒芬太尼在腹腔镜疝修补术中的应用,"彭敏敏, 杨晓斌, 芮亚楠",2024,02,18,https://zhshfbwkzz.cma-cmc.com.cn//CN/article/downloadArticleFile.do?attachType=PDF&id=33129
33130,七氟烷吸入复合瑞芬太尼麻醉在小儿腹腔镜疝修补术中的效果,"郭建丽, 珠娜, 宋飞, 柴国东",2024,02,18,https://zhshfbwkzz.cma-cmc.com.cn//CN/article/downloadArticleFile.do?attachType=PDF&id=33130
33131,多层螺旋CT并多平面重建技术在非裂孔性膈疝与膈膨升术前诊断中的应用,"赵智勇, 闫玉昌, 关磊, 金淑溶, 潘振宇",2024,02,18,https://zhshfbwkzz.cma-cmc.com.cn//CN/article/downloadArticleFile.do?attachType=PDF&id=33131
33132,精细化管理对腹腔镜下腹股沟疝日间手术运行效率的影响,"刘伟, 丁晓寒, 邹振玉, 王景媛, 向承红",2024,02,18,https://zhshfbwkzz.cma-cmc.com.cn//CN/article/downloadArticleFile.do?attachType=PDF&id=33132
33133,疝和腹壁外科进修医师专业化培训的临床实践及思考,朱熠林,2024,02,18,https://zhshfbwkzz.cma-cmc.com.cn//CN/article/downloadArticleFile.do?attachType=PDF&id=33133
33633,胃食管反流病食管外症状抗反流手术适应证及术前评估,"胡志伟, 吴继敏, 汪忠镐, 张美光",2024,03,18,https://zhshfbwkzz.cma-cmc.com.cn//CN/article/downloadArticleFile.do?attachType=PDF&id=33633
33634,复杂腹壁疝微共识：肠瘘及感染相关腹壁疝,"《复杂腹壁疝微共识：肠瘘及感染相关腹壁疝》编审委员会, 《中华疝和腹壁外科杂志（电子版）》编辑委员会, 全国卫生产业企业管理协会疝和腹壁外科产业及临床研究分会复杂腹壁疝及减重专家组",2024,03,18,https://zhshfbwkzz.cma-cmc.com.cn//CN/article/downloadArticleFile.do?attachType=PDF&id=33634
33635,复杂腹壁疝微共识：腹壁疝合并皮肤软组织或补片感染,"《复杂腹壁疝微共识：腹壁疝合并皮肤软组织或补片感染》编审委员会, 《中华疝和腹壁外科杂志（电子版）》编辑委员会, 全国卫生产业企业管理协会疝和腹壁外科产业及临床研究分会复杂腹壁疝及减重专家组",2024,03,18,https://zhshfbwkzz.cma-cmc.com.cn//CN/article/downloadArticleFile.do?attachType=PDF&id=33635
33636,造口旁疝修补专家微共识：预防部分,"《造口旁疝修补专家微共识：预防部分》编审委员会, 《中华疝和腹壁外科杂志（电子版）》编辑委员会, 全国卫生产业企业管理协会疝和腹壁外科产业及临床研究分会造口旁疝专家组",2024,03,18,https://zhshfbwkzz.cma-cmc.com.cn//CN/article/downloadArticleFile.do?attachType=PDF&id=33636
33637,IPOM与Sublay术对腹壁切口疝的疗效与安全性分析,"柯瑞盛, 吴雅琳, 黄坤寨, 刘昭晖, 张福星",2024,03,18,https://zhshfbwkzz.cma-cmc.com.cn//CN/article/downloadArticleFile.do?attachType=PDF&id=33637
33638,膀胱切除术后造口旁疝的治疗,"许熠, 邵翔宇, 李俊生",2024,03,18,https://zhshfbwkzz.cma-cmc.com.cn//CN/article/downloadArticleFile.do?attachType=PDF&id=33638
33639,Miles手术中预置腹膜前补片预防造口旁疝的效果及安全性,"高旭, 李若凡, 孙立新, 刘佐军, 田广健",2024,03,18,https://zhshfbwkzz.cma-cmc.com.cn//CN/article/downloadArticleFile.do?attachType=PDF&id=33639
33640,造口旁疝患者生活质量的影响因素分析,"孙红燕, 李娟",2024,03,18,https://zhshfbwkzz.cma-cmc.com.cn//CN/article/downloadArticleFile.do?attachType=PDF&id=33640
33641,后鞘前入路腹腔镜视野下腹股沟区脂肪归属的解剖要点及临床意义,"许桂祥, 吴海华, 赵鸿志, 徐丽, 胡晓萍, 周世龙, 武永明, 彭新刚",2024,03,18,https://zhshfbwkzz.cma-cmc.com.cn//CN/article/downloadArticleFile.do?attachType=PDF&id=33641
33642,腹腔镜完全腹膜外斜疝修补手术关闭内环口对血清肿发生率的影响,"张庆峰, 邓旭明, 段巧斌, 姚干, 张策",2024,03,18,https://zhshfbwkzz.cma-cmc.com.cn//CN/article/downloadArticleFile.do?attachType=PDF&id=33642
33643,经腹腹膜前疝修补术治疗阴囊疝术后血清肿的相关危险因素分析及预测模型构建,"郝智勇, 雷霞, 张国锋, 李锋",2024,03,18,https://zhshfbwkzz.cma-cmc.com.cn//CN/article/downloadArticleFile.do?attachType=PDF&id=33643
33644,腹腔镜增强视野完全腹膜外疝修补术和腹腔镜腹膜内补片修补术在腹壁疝修补中的安全性及临床疗效,"徐杨荣, 杨毅, 王凤飞, 潘姣",2024,03,18,https://zhshfbwkzz.cma-cmc.com.cn//CN/article/downloadArticleFile.do?attachType=PDF&id=33644
33645,经腹腹膜前与完全腹膜外疝修补术对腹股沟斜疝的临床疗效,"肖家全, 张勇, 严伟",2024,03,18,https://zhshfbwkzz.cma-cmc.com.cn//CN/article/downloadArticleFile.do?attachType=PDF&id=33645
33646,腹股沟疝患者术后手术部位感染的危险因素分析,"王鹏, 翟洪涛, 秦旭东",2024,03,18,https://zhshfbwkzz.cma-cmc.com.cn//CN/article/downloadArticleFile.do?attachType=PDF&id=33646
33647,无张力疝修补术后补片感染32例再手术的疗效分析,"盛伟伟, 林峰, 武梦成, 张嘉炜, 汪明庆, 熊茂明",2024,03,18,https://zhshfbwkzz.cma-cmc.com.cn//CN/article/downloadArticleFile.do?attachType=PDF&id=33647
33648,腹膜外无张力吊带子宫悬吊术治疗盆腔脏器脱垂的疗效,"唐虹, 周奇, 欧阳晓玲, 王永峰, 华宇, 郝小白, 李林霞",2024,03,18,https://zhshfbwkzz.cma-cmc.com.cn//CN/article/downloadArticleFile.do?attachType=PDF&id=33648
33649,两种腹横肌平面阻滞方法在老年择期腹股沟疝修补术中的应用比较,"杨晓宇, 王佳, 张维峰, 陈雨辰",2024,03,18,https://zhshfbwkzz.cma-cmc.com.cn//CN/article/downloadArticleFile.do?attachType=PDF&id=33649
33650,超声引导下骶管阻滞与髂腹股沟及髂腹下神经阻滞用于小儿腹腔镜疝囊高位结扎术的比较,"李盼, 韦登飞, 乔克坤, 李熊刚",2024,03,18,https://zhshfbwkzz.cma-cmc.com.cn//CN/article/downloadArticleFile.do?attachType=PDF&id=33650
33651,加速康复外科理念在儿童腹股沟疝围手术期的应用,"成紫琳, 戴明, 李建华, 马靓",2024,03,18,https://zhshfbwkzz.cma-cmc.com.cn//CN/article/downloadArticleFile.do?attachType=PDF&id=33651
33652,永久性结肠造口预防性补片置入对预防造口旁疝价值的Meta分析,"朱俊佳, 孙琦, 徐文龙, 陆天宇, 冯强, 储涛, 邢春根, 高春冬, 俞一峰, 赵振国",2024,03,18,https://zhshfbwkzz.cma-cmc.com.cn//CN/article/downloadArticleFile.do?attachType=PDF&id=33652
33653,加速康复外科理念应用于腹壁重建手术的系统评价及Meta分析,"王招荐, 曹桢, 郭小双, 靳小雷, 刘子文",2024,03,18,https://zhshfbwkzz.cma-cmc.com.cn//CN/article/downloadArticleFile.do?attachType=PDF&id=33653
33654,腹腔镜完全腹膜外Sandwich造口旁疝修补术一例,"蒋会勇, 杨斌, 蔡相军",2024,03,18,https://zhshfbwkzz.cma-cmc.com.cn//CN/article/downloadArticleFile.do?attachType=PDF&id=33654
33619,创伤性膈疝合并小肠嵌顿梗阻一例,"金双, 耿全利, 聂岩, 倪永健, 叶晋生",2024,03,18,https://zhshfbwkzz.cma-cmc.com.cn//CN/article/downloadArticleFile.do?attachType=PDF&id=33619
33655,外科医护人员预防腹壁切口疝知信行现状的调查研究,"张海泳, 吕思扬, 黄静, 商玉环",2024,03,18,https://zhshfbwkzz.cma-cmc.com.cn//CN/article/downloadArticleFile.do?attachType=PDF&id=33655
34370,复杂腹壁疝微共识：边缘区域腹壁疝,"《复杂腹壁疝微共识：边缘区域腹壁疝》编审委员会, 《中华疝和腹壁外科杂志（电子版）》编辑委员会, 全国卫生产业企业管理协会疝和腹壁外科产业及临床研究分会复杂腹壁疝及减重专家组",2024,04,18,https://zhshfbwkzz.cma-cmc.com.cn//CN/article/downloadArticleFile.do?attachType=PDF&id=34370
34371,疝补片的发展：从人工补片到智能材料,"汤福鑫, 黄浩男, 马宁, 周太成, 陈双",2024,04,18,https://zhshfbwkzz.cma-cmc.com.cn//CN/article/downloadArticleFile.do?attachType=PDF&id=34371
34372,腹腔镜下腹股沟疝修补术后并发症及防治进展,"李康虎, 王继伟, 王光远",2024,04,18,https://zhshfbwkzz.cma-cmc.com.cn//CN/article/downloadArticleFile.do?attachType=PDF&id=34372
34373,机器人与腹腔镜食管裂孔疝修补术对比研究,"刘明昊, 李晨, 王冰, 万政, 田文",2024,04,18,https://zhshfbwkzz.cma-cmc.com.cn//CN/article/downloadArticleFile.do?attachType=PDF&id=34373
34374,青海地区不同海拔男性腹股沟疝患者腹壁组织Ⅰ、Ⅲ型胶原纤维表达的研究,"张洁宇, 朱文君, 高伟, 王新昇, 贺贝贝, 吴世乐",2024,04,18,https://zhshfbwkzz.cma-cmc.com.cn//CN/article/downloadArticleFile.do?attachType=PDF&id=34374
34375,腹腔镜经腹腹膜前疝修补术后尿潴留发生率及危险因素分析,"周劲鸿, 王鉴杰, 谢肖俊",2024,04,18,https://zhshfbwkzz.cma-cmc.com.cn//CN/article/downloadArticleFile.do?attachType=PDF&id=34375
34376,前列腺癌术后腹股沟疝的发生率及危险因素分析,"陈钊, 钟克力, 江志鹏, 傅宇翔, 范宝航, 吴文飞",2024,04,18,https://zhshfbwkzz.cma-cmc.com.cn//CN/article/downloadArticleFile.do?attachType=PDF&id=34376
34377,腹腔镜疝修补术腹膜前负压引流的效果和长期安全性研究,"邓杨, 彭豪, 刘剑文",2024,04,18,https://zhshfbwkzz.cma-cmc.com.cn//CN/article/downloadArticleFile.do?attachType=PDF&id=34377
34378,补片固定与否对腹股沟疝经腹腹膜前修补术后患者并发症的影响,"邱志东, 张杰, 薛鹏, 郑玲玲, 杨建桃, 赵海军, 陈双",2024,04,18,https://zhshfbwkzz.cma-cmc.com.cn//CN/article/downloadArticleFile.do?attachType=PDF&id=34378
34379,改良医用胶粘合假疝囊技术预防腹腔镜完全腹膜外疝修补术后血清肿的临床研究,"申亚伟, 黄新, 李万林",2024,04,18,https://zhshfbwkzz.cma-cmc.com.cn//CN/article/downloadArticleFile.do?attachType=PDF&id=34379
34380,腹腔镜完全腹膜外患侧外侧间隙入路腹股沟疝修补术,"蒋会勇, 杨柳, 郭吉祥, 王春帅, 马春, 李琦, 蔡相军",2024,04,18,https://zhshfbwkzz.cma-cmc.com.cn//CN/article/downloadArticleFile.do?attachType=PDF&id=34380
34381,腹壁切口疝分型与手术前后腹腔压力的相关性,"彭雪峰, 杨华, 李慧, 宋应寒, 张雨晨, 雷文章",2024,04,18,https://zhshfbwkzz.cma-cmc.com.cn//CN/article/downloadArticleFile.do?attachType=PDF&id=34381
34382,不同补片用于腹股沟疝腹腔镜手术中的安全性及对患者功能康复的影响,"许伟, 曹道成, 孙畅, 马雨九",2024,04,18,https://zhshfbwkzz.cma-cmc.com.cn//CN/article/downloadArticleFile.do?attachType=PDF&id=34382
34383,保留子宫圆韧带及补片完整的经腹腹膜前疝修补术的早期经验,"郑燕生, 吴舒婷",2024,04,18,https://zhshfbwkzz.cma-cmc.com.cn//CN/article/downloadArticleFile.do?attachType=PDF&id=34383
34384,圆韧带悬吊联合腹腔镜子宫全切术对患者术后阴道膨出的影响,"田淞宇, 张明月, 张宇博",2024,04,18,https://zhshfbwkzz.cma-cmc.com.cn//CN/article/downloadArticleFile.do?attachType=PDF&id=34384
34385,右美托咪定对腹腔镜腹股沟疝修补术患者血流动力学及麻醉复苏效果的影响,"李先锋, 何懿, 程贞永, 邓国魁, 胡波, 谢红, 王莉, 王小燕, 李晓明",2024,04,18,https://zhshfbwkzz.cma-cmc.com.cn//CN/article/downloadArticleFile.do?attachType=PDF&id=34385
34386,局部神经阻滞麻醉在成人腹股沟疝无张力修补术中的应用,"窦恩, 郑磊, 徐通海, 邓先锐",2024,04,18,https://zhshfbwkzz.cma-cmc.com.cn//CN/article/downloadArticleFile.do?attachType=PDF&id=34386
34387,术前右美托咪定滴鼻在腹股沟斜疝患儿腹腔镜下疝囊高位结扎术中的应用,"韦雅丽, 范利杰",2024,04,18,https://zhshfbwkzz.cma-cmc.com.cn//CN/article/downloadArticleFile.do?attachType=PDF&id=34387
34388,SBAR沟通模式在急诊腹股沟疝手术患者中的应用研究,"刘欣茹, 杜鹃, 代健健, 辛秀娟, 高梨梨",2024,04,18,https://zhshfbwkzz.cma-cmc.com.cn//CN/article/downloadArticleFile.do?attachType=PDF&id=34388
34389,标准化人文关怀服务在腹腔镜腹股沟疝修补术中的应用,"许文娟, 伍翠云, 许燕, 倪超",2024,04,18,https://zhshfbwkzz.cma-cmc.com.cn//CN/article/downloadArticleFile.do?attachType=PDF&id=34389
34390,个体化护理对腹股沟疝无张力修补术后疼痛及舒适度的影响,"徐淑英, 张汪, 王玲, 江照凤",2024,04,18,https://zhshfbwkzz.cma-cmc.com.cn//CN/article/downloadArticleFile.do?attachType=PDF&id=34390
34391,腹腔镜视野下直疝疝囊进入阴囊的解剖观察及原因分析,"许桂祥, 徐丽, 赵鸿志, 周世龙, 武永明, 彭新刚",2024,04,18,https://zhshfbwkzz.cma-cmc.com.cn//CN/article/downloadArticleFile.do?attachType=PDF&id=34391
34392,肝移植术后腹壁疝诊治初步经验,"黄建朋, 邹建强, 宗华",2024,04,18,https://zhshfbwkzz.cma-cmc.com.cn//CN/article/downloadArticleFile.do?attachType=PDF&id=34392
34393,左侧膈膨升伴急性胃扭转、游离脾一例并文献综述,"曾兵, 甘文昌, 彭绍勇, 刘付恒, 元志龙, 周太成, 陈双, 李英儒",2024,04,18,https://zhshfbwkzz.cma-cmc.com.cn//CN/article/downloadArticleFile.do?attachType=PDF&id=34393
34394,从一例腹直肌萎缩的CT影像特点探讨腹直肌鞘的解剖本质,"李亮, 石威文, 刘铮",2024,04,18,https://zhshfbwkzz.cma-cmc.com.cn//CN/article/downloadArticleFile.do?attachType=PDF&id=34394
34966,复杂腹壁疝微共识：复发腹壁疝手术及腹腔广泛粘连的处理,"《复杂腹壁疝微共识：复发腹壁疝手术及腹腔广泛粘连的处理》编审委员会, 《中华疝和腹壁外科杂志（电子版）》编辑委员会, 全国卫生产业企业管理协会疝和腹壁外科产业及临床研究分会复杂腹壁疝及减重专家组",2024,05,18,https://zhshfbwkzz.cma-cmc.com.cn//CN/article/downloadArticleFile.do?attachType=PDF&id=34966
34967,胃底折叠术预防食管裂孔疝术后并发症的研究进展,"李海云, 赵敏娴, 申英末, 杨慧琪",2024,05,18,https://zhshfbwkzz.cma-cmc.com.cn//CN/article/downloadArticleFile.do?attachType=PDF&id=34967
34968,食管裂孔疝合并胃食管反流病治疗现状及与胃食管结合部肿瘤的关系,"仝聪, 周哲琦, 阎立昆",2024,05,18,https://zhshfbwkzz.cma-cmc.com.cn//CN/article/downloadArticleFile.do?attachType=PDF&id=34968
34969,不同检查方法对巨大食管裂孔疝合并胃食管反流病的诊断价值及各检查指标间的相关性分析,"王浩, 艾克拜尔·艾力, 麦麦提艾力·麦麦提明, 李义亮, 克力木·阿不都热依木",2024,05,18,https://zhshfbwkzz.cma-cmc.com.cn//CN/article/downloadArticleFile.do?attachType=PDF&id=34969
34970,腹腔镜袖状胃切除或联合食管裂孔疝修补术对肥胖症合并胃食管反流病的中期疗效分析,"玉素江·图荪托合提, 韩琦, 麦麦提艾力·麦麦提明, 黄旭东, 王浩, 克力木·阿不都热依木, 艾克拜尔·艾力",2024,05,18,https://zhshfbwkzz.cma-cmc.com.cn//CN/article/downloadArticleFile.do?attachType=PDF&id=34970
34971,腹腔镜疝修补术联合胃底折叠术治疗食管裂孔疝合并胃食管反流病40 例临床分析,"任传富, 杨志, 徐恩, 何梓芸, 罗板鑫, 陈新, 夏雪峰",2024,05,18,https://zhshfbwkzz.cma-cmc.com.cn//CN/article/downloadArticleFile.do?attachType=PDF&id=34971
34972,机器人与腹腔镜食管裂孔疝修补术联合Nissen 胃底折叠术短期疗效分析,"李义亮, 苏拉依曼·牙库甫, 麦麦提艾力·麦麦提明, 克力木·阿不都热依木",2024,05,18,https://zhshfbwkzz.cma-cmc.com.cn//CN/article/downloadArticleFile.do?attachType=PDF&id=34972
